"No.","Time","Source","Destination","Protocol","Length","Info"
"1","0.000000000","24.6.173.220","75.75.75.75","DNS","74","Standard query 0x5285  A www.sfgate.com"
"2","0.012983000","75.75.75.75","24.6.173.220","DNS","132","Standard query response 0x5285  CNAME orig-10034.hearst.cotcdn.net A 208.93.137.180"
"3","0.014193000","24.6.173.220","75.75.75.75","DNS","74","Standard query 0x30b7  AAAA www.sfgate.com"
"4","0.034265000","75.75.75.75","24.6.173.220","DNS","175","Standard query response 0x30b7  CNAME orig-10034.hearst.cotcdn.net"
"5","0.035587000","24.6.173.220","208.93.137.180","TCP","66","10615 > 80 [SYN] Seq=0 Win=8192 Len=0 MSS=1460 WS=4 SACK_PERM=1"
"6","0.053914000","208.93.137.180","24.6.173.220","TCP","66","80 > 10615 [SYN, ACK] Seq=0 Ack=1 Win=5840 Len=0 MSS=1460 SACK_PERM=1 WS=128"
"7","0.054046000","24.6.173.220","208.93.137.180","TCP","54","10615 > 80 [ACK] Seq=1 Ack=1 Win=65700 Len=0"
"8","0.054566000","24.6.173.220","208.93.137.180","HTTP","549","GET /feedback/ HTTP/1.1 "
"9","0.075760000","208.93.137.180","24.6.173.220","TCP","60","80 > 10615 [ACK] Seq=1 Ack=496 Win=6912 Len=0"
"10","0.198335000","208.93.137.180","24.6.173.220","TCP","1514","[TCP segment of a reassembled PDU]"
"11","0.200520000","208.93.137.180","24.6.173.220","TCP","1514","[TCP segment of a reassembled PDU]"
"12","0.202180000","24.6.173.220","208.93.137.180","TCP","54","10615 > 80 [ACK] Seq=496 Ack=2921 Win=65700 Len=0"
"13","0.228194000","24.6.173.220","208.93.137.180","TCP","66","10616 > 80 [SYN] Seq=0 Win=8192 Len=0 MSS=1460 WS=4 SACK_PERM=1"
"14","0.229065000","24.6.173.220","208.93.137.180","TCP","66","10617 > 80 [SYN] Seq=0 Win=8192 Len=0 MSS=1460 WS=4 SACK_PERM=1"
"15","0.229307000","24.6.173.220","208.93.137.180","TCP","66","10618 > 80 [SYN] Seq=0 Win=8192 Len=0 MSS=1460 WS=4 SACK_PERM=1"
"16","0.229807000","24.6.173.220","75.75.75.75","DNS","76","Standard query 0xbb19  A aps.hearstnp.com"
"17","0.229919000","24.6.173.220","208.93.137.180","TCP","66","10619 > 80 [SYN] Seq=0 Win=8192 Len=0 MSS=1460 WS=4 SACK_PERM=1"
"18","0.230370000","24.6.173.220","208.93.137.180","TCP","66","10620 > 80 [SYN] Seq=0 Win=8192 Len=0 MSS=1460 WS=4 SACK_PERM=1"
"19","0.230395000","24.6.173.220","75.75.75.75","DNS","95","Standard query 0x86c3  A digitaldoor.subscriberconcierge.com"
"20","0.243244000","208.93.137.180","24.6.173.220","TCP","1514","[TCP segment of a reassembled PDU]"
"21","0.245418000","208.93.137.180","24.6.173.220","TCP","1514","[TCP segment of a reassembled PDU]"
"22","0.245423000","208.93.137.180","24.6.173.220","TCP","1514","[TCP segment of a reassembled PDU]"
"23","0.245425000","208.93.137.180","24.6.173.220","TCP","1514","[TCP segment of a reassembled PDU]"
"24","0.247747000","24.6.173.220","208.93.137.180","TCP","54","10615 > 80 [ACK] Seq=496 Ack=8761 Win=65700 Len=0"
"25","0.248535000","208.93.137.180","24.6.173.220","TCP","66","80 > 10616 [SYN, ACK] Seq=0 Ack=1 Win=5840 Len=0 MSS=1460 SACK_PERM=1 WS=128"
"26","0.248536000","208.93.137.180","24.6.173.220","TCP","66","80 > 10617 [SYN, ACK] Seq=0 Ack=1 Win=5840 Len=0 MSS=1460 SACK_PERM=1 WS=128"
"27","0.248538000","208.93.137.180","24.6.173.220","TCP","66","80 > 10618 [SYN, ACK] Seq=0 Ack=1 Win=5840 Len=0 MSS=1460 SACK_PERM=1 WS=128"
"28","0.248540000","75.75.75.75","24.6.173.220","DNS","111","Standard query response 0x86c3  A 66.109.241.50"
"29","0.248541000","75.75.75.75","24.6.173.220","DNS","134","Standard query response 0xbb19  CNAME orig-10050.hearst.cotcdn.net A 208.93.137.180"
"30","0.248727000","24.6.173.220","208.93.137.180","TCP","54","10616 > 80 [ACK] Seq=1 Ack=1 Win=65700 Len=0"
"31","0.248773000","24.6.173.220","208.93.137.180","TCP","54","10617 > 80 [ACK] Seq=1 Ack=1 Win=65700 Len=0"
"32","0.248798000","24.6.173.220","208.93.137.180","TCP","54","10618 > 80 [ACK] Seq=1 Ack=1 Win=65700 Len=0"
"33","0.249392000","24.6.173.220","208.93.137.180","HTTP","383","GET /external/css/global.shared.2.8.4p3.19000.css HTTP/1.1 "
"34","0.249817000","24.6.173.220","208.93.137.180","HTTP","381","GET /external/css/global.site.2.8.4p3.19000.css HTTP/1.1 "
"35","0.249818000","24.6.173.220","75.75.75.75","DNS","76","Standard query 0xd557  AAAA aps.hearstnp.com"
"36","0.249841000","24.6.173.220","75.75.75.75","DNS","95","Standard query 0xe6fc  AAAA digitaldoor.subscriberconcierge.com"
"37","0.250116000","24.6.173.220","208.93.137.180","HTTP","366","GET /external/js/global.header.2.8.4p3.19000.js HTTP/1.1 "
"38","0.251332000","208.93.137.180","24.6.173.220","TCP","66","80 > 10619 [SYN, ACK] Seq=0 Ack=1 Win=5840 Len=0 MSS=1460 SACK_PERM=1 WS=128"
"39","0.251334000","208.93.137.180","24.6.173.220","TCP","60","80 > 10620 [SYN, ACK] Seq=0 Ack=1 Win=5840 Len=0 MSS=1460"
"40","0.251444000","24.6.173.220","208.93.137.180","TCP","54","10619 > 80 [ACK] Seq=1 Ack=1 Win=65700 Len=0"
"41","0.251473000","24.6.173.220","208.93.137.180","TCP","54","10620 > 80 [ACK] Seq=1 Ack=1 Win=256960 Len=0"
"42","0.251759000","24.6.173.220","208.93.137.180","HTTP","370","GET /css/pages/sections/feedback.css HTTP/1.1 "
"43","0.252170000","24.6.173.220","208.93.137.180","HTTP","363","GET /external/js/global.top.2.8.4p3.19000.js HTTP/1.1 "
"44","0.267873000","208.93.137.180","24.6.173.220","TCP","60","80 > 10616 [ACK] Seq=1 Ack=330 Win=6912 Len=0"
"45","0.268632000","208.93.137.180","24.6.173.220","TCP","1514","[TCP segment of a reassembled PDU]"
"46","0.269652000","208.93.137.180","24.6.173.220","TCP","1514","[TCP segment of a reassembled PDU]"
"47","0.269655000","208.93.137.180","24.6.173.220","TCP","1514","[TCP segment of a reassembled PDU]"
"48","0.269657000","208.93.137.180","24.6.173.220","TCP","60","80 > 10617 [ACK] Seq=1 Ack=328 Win=6912 Len=0"
"49","0.269662000","208.93.137.180","24.6.173.220","TCP","1514","[TCP segment of a reassembled PDU]"
"50","0.270234000","24.6.173.220","208.93.137.180","TCP","54","10616 > 80 [ACK] Seq=330 Ack=4381 Win=65700 Len=0"
"51","0.270997000","208.93.137.180","24.6.173.220","TCP","1514","[TCP segment of a reassembled PDU]"
"52","0.271000000","208.93.137.180","24.6.173.220","TCP","1514","[TCP segment of a reassembled PDU]"
"53","0.271369000","24.6.173.220","208.93.137.180","TCP","54","10617 > 80 [ACK] Seq=328 Ack=4381 Win=65700 Len=0"
"54","0.272172000","208.93.137.180","24.6.173.220","TCP","1514","[TCP segment of a reassembled PDU]"
"55","0.272174000","208.93.137.180","24.6.173.220","TCP","1514","[TCP segment of a reassembled PDU]"
"56","0.272178000","208.93.137.180","24.6.173.220","TCP","1514","[TCP segment of a reassembled PDU]"
"57","0.272864000","24.6.173.220","208.93.137.180","TCP","54","10617 > 80 [ACK] Seq=328 Ack=8761 Win=65700 Len=0"
"58","0.273613000","208.93.137.180","24.6.173.220","TCP","1514","[TCP segment of a reassembled PDU]"
"59","0.273615000","208.93.137.180","24.6.173.220","TCP","1514","[TCP segment of a reassembled PDU]"
"60","0.273622000","208.93.137.180","24.6.173.220","TCP","1514","[TCP segment of a reassembled PDU]"
"61","0.274192000","24.6.173.220","208.93.137.180","TCP","54","10617 > 80 [ACK] Seq=328 Ack=13141 Win=65700 Len=0"
"62","0.274940000","208.93.137.180","24.6.173.220","TCP","1514","[TCP segment of a reassembled PDU]"
"63","0.274942000","208.93.137.180","24.6.173.220","TCP","1514","[TCP segment of a reassembled PDU]"
"64","0.274945000","208.93.137.180","24.6.173.220","TCP","1514","[TCP segment of a reassembled PDU]"
"65","0.274950000","208.93.137.180","24.6.173.220","HTTP","472","HTTP/1.1 200 OK  (text/css)"
"66","0.274955000","75.75.75.75","24.6.173.220","DNS","150","Standard query response 0xe6fc "
"67","0.275594000","24.6.173.220","208.93.137.180","TCP","54","10617 > 80 [ACK] Seq=328 Ack=17939 Win=65700 Len=0"
"68","0.275990000","24.6.173.220","208.93.137.180","HTTP","354","GET /js/omniture/analyticsconfig.js HTTP/1.1 "
"69","0.276325000","24.6.173.220","66.109.241.50","TCP","66","10621 > 80 [SYN] Seq=0 Win=8192 Len=0 MSS=1460 WS=4 SACK_PERM=1"
"70","0.276463000","208.93.137.180","24.6.173.220","TCP","60","80 > 10618 [ACK] Seq=1 Ack=313 Win=6912 Len=0"
"71","0.276478000","208.93.137.180","24.6.173.220","TCP","60","80 > 10619 [ACK] Seq=1 Ack=317 Win=6912 Len=0"
"72","0.276479000","208.93.137.180","24.6.173.220","TCP","60","80 > 10620 [ACK] Seq=1 Ack=310 Win=6432 Len=0"
"73","0.276480000","208.93.137.180","24.6.173.220","HTTP","478","HTTP/1.1 200 OK  (application/x-javascript) (application/x-javascript)"
"74","0.276482000","208.93.137.180","24.6.173.220","HTTP","1195","HTTP/1.1 200 OK  (text/css)"
"75","0.276483000","208.93.137.180","24.6.173.220","TCP","1514","[TCP segment of a reassembled PDU]"
"76","0.276638000","24.6.173.220","66.109.241.50","TCP","66","10622 > 80 [SYN] Seq=0 Win=8192 Len=0 MSS=1460 WS=4 SACK_PERM=1"
"77","0.277345000","24.6.173.220","66.109.241.50","TCP","66","10623 > 80 [SYN] Seq=0 Win=8192 Len=0 MSS=1460 WS=4 SACK_PERM=1"
"78","0.277873000","208.93.137.180","24.6.173.220","TCP","1514","[TCP segment of a reassembled PDU]"
"79","0.277876000","208.93.137.180","24.6.173.220","TCP","1514","[TCP segment of a reassembled PDU]"
"80","0.277879000","208.93.137.180","24.6.173.220","TCP","1514","[TCP segment of a reassembled PDU]"
"81","0.277884000","208.93.137.180","24.6.173.220","TCP","1514","[TCP segment of a reassembled PDU]"
"82","0.278011000","24.6.173.220","66.109.241.50","TCP","66","10624 > 80 [SYN] Seq=0 Win=8192 Len=0 MSS=1460 WS=4 SACK_PERM=1"
"83","0.278273000","24.6.173.220","208.93.137.180","HTTP","349","GET /js/hdn/omniture/s_code.js HTTP/1.1 "
"84","0.278562000","24.6.173.220","208.93.137.180","HTTP","355","GET /js/hdn/omniture/analyticswcm.js HTTP/1.1 "
"85","0.279293000","24.6.173.220","208.93.137.180","TCP","54","10618 > 80 [ACK] Seq=313 Ack=7301 Win=65700 Len=0"
"86","0.280050000","208.93.137.180","24.6.173.220","TCP","1514","[TCP segment of a reassembled PDU]"
"87","0.280053000","208.93.137.180","24.6.173.220","TCP","1514","[TCP segment of a reassembled PDU]"
"88","0.280057000","208.93.137.180","24.6.173.220","TCP","1514","[TCP segment of a reassembled PDU]"
"89","0.280060000","208.93.137.180","24.6.173.220","TCP","1514","[TCP segment of a reassembled PDU]"
"90","0.281497000","24.6.173.220","208.93.137.180","TCP","54","10618 > 80 [ACK] Seq=313 Ack=13141 Win=65700 Len=0"
"91","0.282254000","208.93.137.180","24.6.173.220","TCP","1514","[TCP segment of a reassembled PDU]"
"92","0.282257000","208.93.137.180","24.6.173.220","TCP","1514","[TCP segment of a reassembled PDU]"
"93","0.282262000","208.93.137.180","24.6.173.220","TCP","1514","[TCP segment of a reassembled PDU]"
"94","0.282266000","208.93.137.180","24.6.173.220","TCP","1514","[TCP segment of a reassembled PDU]"
"95","0.282268000","208.93.137.180","24.6.173.220","TCP","1514","[TCP segment of a reassembled PDU]"
"96","0.284262000","24.6.173.220","208.93.137.180","TCP","54","10618 > 80 [ACK] Seq=313 Ack=20441 Win=65700 Len=0"
"97","0.285017000","208.93.137.180","24.6.173.220","TCP","1514","[TCP segment of a reassembled PDU]"
"98","0.285020000","208.93.137.180","24.6.173.220","TCP","1514","[TCP segment of a reassembled PDU]"
"99","0.285024000","208.93.137.180","24.6.173.220","TCP","1514","[TCP segment of a reassembled PDU]"
"100","0.285027000","208.93.137.180","24.6.173.220","TCP","1514","[TCP segment of a reassembled PDU]"
"101","0.285029000","208.93.137.180","24.6.173.220","TCP","1514","[TCP segment of a reassembled PDU]"
"102","0.285032000","208.93.137.180","24.6.173.220","TCP","1514","[TCP segment of a reassembled PDU]"
"103","0.287745000","24.6.173.220","208.93.137.180","TCP","54","10618 > 80 [ACK] Seq=313 Ack=29201 Win=65700 Len=0"
"104","0.288513000","208.93.137.180","24.6.173.220","TCP","1514","[TCP segment of a reassembled PDU]"
"105","0.288515000","208.93.137.180","24.6.173.220","TCP","1514","[TCP segment of a reassembled PDU]"
"106","0.288517000","75.75.75.75","24.6.173.220","DNS","177","Standard query response 0xd557  CNAME orig-10050.hearst.cotcdn.net"
"107","0.288522000","208.93.137.180","24.6.173.220","TCP","1514","[TCP segment of a reassembled PDU]"
"108","0.288537000","208.93.137.180","24.6.173.220","TCP","1514","[TCP segment of a reassembled PDU]"
"109","0.288539000","208.93.137.180","24.6.173.220","TCP","1514","[TCP segment of a reassembled PDU]"
"110","0.288545000","208.93.137.180","24.6.173.220","TCP","1514","[TCP segment of a reassembled PDU]"
"111","0.289717000","24.6.173.220","208.93.137.180","TCP","54","10618 > 80 [ACK] Seq=313 Ack=32121 Win=65700 Len=0"
"112","0.290641000","24.6.173.220","208.93.137.180","TCP","54","10616 > 80 [ACK] Seq=330 Ack=10221 Win=65700 Len=0"
"113","0.291040000","24.6.173.220","208.93.137.180","TCP","66","10625 > 80 [SYN] Seq=0 Win=8192 Len=0 MSS=1460 WS=4 SACK_PERM=1"
"114","0.291317000","24.6.173.220","208.93.137.180","TCP","66","10626 > 80 [SYN] Seq=0 Win=8192 Len=0 MSS=1460 WS=4 SACK_PERM=1"
"115","0.291397000","208.93.137.180","24.6.173.220","TCP","1514","[TCP segment of a reassembled PDU]"
"116","0.291399000","208.93.137.180","24.6.173.220","TCP","1514","[TCP segment of a reassembled PDU]"
"117","0.291402000","208.93.137.180","24.6.173.220","TCP","1514","[TCP segment of a reassembled PDU]"
"118","0.291408000","208.93.137.180","24.6.173.220","TCP","1514","[TCP segment of a reassembled PDU]"
"119","0.291410000","208.93.137.180","24.6.173.220","HTTP","891","HTTP/1.1 200 OK  (text/html)"
"120","0.294617000","24.6.173.220","75.75.75.75","DNS","73","Standard query 0xf961  A ww3.hdnux.com"
"121","0.294864000","24.6.173.220","75.75.75.75","DNS","73","Standard query 0x0273  A ww1.hdnux.com"
"122","0.295007000","24.6.173.220","75.75.75.75","DNS","73","Standard query 0x7393  A ww2.hdnux.com"
"123","0.295086000","24.6.173.220","208.93.137.180","TCP","54","10615 > 80 [ACK] Seq=496 Ack=15438 Win=65700 Len=0"
"124","0.295795000","24.6.173.220","208.93.137.180","HTTP","344","GET /js/hdn/ysmwrapper.js HTTP/1.1 "
"125","0.297128000","208.93.137.180","24.6.173.220","TCP","1514","[TCP segment of a reassembled PDU]"
"126","0.298611000","208.93.137.180","24.6.173.220","HTTP","392","HTTP/1.1 200 OK  (application/x-javascript)"
"127","0.298613000","208.93.137.180","24.6.173.220","TCP","1514","[TCP segment of a reassembled PDU]"
"128","0.298616000","208.93.137.180","24.6.173.220","TCP","1514","[TCP segment of a reassembled PDU]"
"129","0.298618000","208.93.137.180","24.6.173.220","TCP","1514","[TCP segment of a reassembled PDU]"
"130","0.298621000","208.93.137.180","24.6.173.220","HTTP","925","HTTP/1.1 200 OK  (application/x-javascript)"
"131","0.298977000","24.6.173.220","75.75.75.75","DNS","88","Standard query 0xcf9a  A us2widget.nimblecommerce.com"
"132","0.299642000","24.6.173.220","75.75.75.75","DNS","88","Standard query 0xfe93  A analytics.apnewsregistry.com"
"133","0.299935000","24.6.173.220","75.75.75.75","DNS","75","Standard query 0x6505  A imgs.sfgate.com"
"134","0.300282000","24.6.173.220","208.93.137.180","TCP","54","10618 > 80 [ACK] Seq=313 Ack=33919 Win=65700 Len=0"
"135","0.300310000","24.6.173.220","208.93.137.180","TCP","54","10619 > 80 [ACK] Seq=618 Ack=5522 Win=65700 Len=0"
"136","0.301020000","24.6.173.220","208.93.137.180","HTTP","366","GET /external/js/global.bottom.2.8.4p3.19000.js HTTP/1.1 "
"137","0.301066000","208.93.137.180","24.6.173.220","TCP","1514","[TCP segment of a reassembled PDU]"
"138","0.301068000","208.93.137.180","24.6.173.220","TCP","1514","[TCP segment of a reassembled PDU]"
"139","0.301071000","208.93.137.180","24.6.173.220","TCP","1514","[TCP segment of a reassembled PDU]"
"140","0.301073000","208.93.137.180","24.6.173.220","TCP","1514","[TCP segment of a reassembled PDU]"
"141","0.301075000","208.93.137.180","24.6.173.220","TCP","1514","[TCP segment of a reassembled PDU]"
"142","0.302561000","24.6.173.220","208.93.137.180","TCP","54","10620 > 80 [ACK] Seq=605 Ack=6265 Win=256960 Len=0"
"143","0.303043000","24.6.173.220","208.93.137.180","HTTP","395","GET /img/modules/siteheader/chron_we_promo.gif HTTP/1.1 "
"144","0.303365000","208.93.137.180","24.6.173.220","TCP","1514","[TCP segment of a reassembled PDU]"
"145","0.303367000","208.93.137.180","24.6.173.220","TCP","1514","[TCP segment of a reassembled PDU]"
"146","0.303370000","208.93.137.180","24.6.173.220","TCP","1514","[TCP segment of a reassembled PDU]"
"147","0.303372000","208.93.137.180","24.6.173.220","TCP","1514","[TCP segment of a reassembled PDU]"
"148","0.303374000","208.93.137.180","24.6.173.220","TCP","1514","[TCP segment of a reassembled PDU]"
"149","0.304922000","24.6.173.220","208.93.137.180","TCP","54","10620 > 80 [ACK] Seq=605 Ack=13565 Win=256960 Len=0"
"150","0.305737000","208.93.137.180","24.6.173.220","TCP","1514","[TCP segment of a reassembled PDU]"
"151","0.305740000","208.93.137.180","24.6.173.220","TCP","1514","[TCP segment of a reassembled PDU]"
"152","0.305743000","208.93.137.180","24.6.173.220","TCP","1514","[TCP segment of a reassembled PDU]"
"153","0.305745000","208.93.137.180","24.6.173.220","TCP","1514","[TCP segment of a reassembled PDU]"
"154","0.305747000","208.93.137.180","24.6.173.220","HTTP","269","HTTP/1.1 200 OK  (application/x-javascript)"
"155","0.307071000","24.6.173.220","208.93.137.180","TCP","54","10620 > 80 [ACK] Seq=605 Ack=19620 Win=256960 Len=0"
"156","0.307355000","24.6.173.220","208.93.137.180","HTTP","386","GET /img/modules/siteheader/brand.png HTTP/1.1 "
"157","0.308581000","208.93.137.180","24.6.173.220","TCP","66","80 > 10625 [SYN, ACK] Seq=0 Ack=1 Win=5840 Len=0 MSS=1460 SACK_PERM=1 WS=128"
"158","0.308806000","24.6.173.220","208.93.137.180","TCP","54","10625 > 80 [ACK] Seq=1 Ack=1 Win=65700 Len=0"
"159","0.309161000","24.6.173.220","208.93.137.180","HTTP","344","GET /Scripts/loadAds.js HTTP/1.1 "
"160","0.309558000","208.93.137.180","24.6.173.220","TCP","1514","[TCP segment of a reassembled PDU]"
"161","0.309560000","208.93.137.180","24.6.173.220","TCP","66","80 > 10626 [SYN, ACK] Seq=0 Ack=1 Win=5840 Len=0 MSS=1460 SACK_PERM=1 WS=128"
"162","0.309793000","24.6.173.220","208.93.137.180","TCP","54","10626 > 80 [ACK] Seq=1 Ack=1 Win=65700 Len=0"
"163","0.310548000","208.93.137.180","24.6.173.220","TCP","1514","[TCP segment of a reassembled PDU]"
"164","0.310552000","208.93.137.180","24.6.173.220","TCP","1514","[TCP segment of a reassembled PDU]"
"165","0.310554000","208.93.137.180","24.6.173.220","TCP","1514","[TCP segment of a reassembled PDU]"
"166","0.311122000","24.6.173.220","208.93.137.180","TCP","54","10616 > 80 [ACK] Seq=330 Ack=16061 Win=65700 Len=0"
"167","0.311871000","208.93.137.180","24.6.173.220","TCP","1514","[TCP segment of a reassembled PDU]"
"168","0.311874000","75.75.75.75","24.6.173.220","DNS","131","Standard query response 0x0273  CNAME orig-10055.hearst.cotcdn.net A 208.93.137.180"
"169","0.311875000","75.75.75.75","24.6.173.220","DNS","131","Standard query response 0xf961  CNAME orig-10055.hearst.cotcdn.net A 208.93.137.180"
"170","0.311877000","75.75.75.75","24.6.173.220","DNS","131","Standard query response 0x7393  CNAME orig-10055.hearst.cotcdn.net A 208.93.137.180"
"171","0.312880000","24.6.173.220","75.75.75.75","DNS","73","Standard query 0xf57e  AAAA ww3.hdnux.com"
"172","0.312960000","24.6.173.220","75.75.75.75","DNS","73","Standard query 0x01b9  AAAA ww2.hdnux.com"
"173","0.313039000","24.6.173.220","75.75.75.75","DNS","73","Standard query 0xba50  AAAA ww1.hdnux.com"
"174","0.313680000","208.93.137.180","24.6.173.220","TCP","60","80 > 10615 [ACK] Seq=15438 Ack=786 Win=8064 Len=0"
"175","0.314498000","208.93.137.180","24.6.173.220","TCP","1514","[TCP segment of a reassembled PDU]"
"176","0.315721000","208.93.137.180","24.6.173.220","HTTP","940","HTTP/1.1 200 OK  (application/x-javascript)"
"177","0.315726000","75.75.75.75","24.6.173.220","DNS","218","Standard query response 0xfe93  CNAME prod-tracking-http-89765270.us-east-1.elb.amazonaws.com A 107.22.233.219 A 23.21.54.17 A 23.21.50.193 A 23.21.231.73"
"178","0.315728000","75.75.75.75","24.6.173.220","DNS","133","Standard query response 0x6505  CNAME orig-10056.hearst.cotcdn.net A 208.93.137.190"
"179","0.315730000","75.75.75.75","24.6.173.220","DNS","208","Standard query response 0xcf9a  CNAME www1nc-1174862120.us-east-1.elb.amazonaws.com A 184.73.197.77 A 54.243.165.93 A 184.73.204.71 A 50.17.227.189"
"180","0.316149000","24.6.173.220","208.93.137.180","TCP","54","10615 > 80 [ACK] Seq=786 Ack=17784 Win=65700 Len=0"
"181","0.316488000","24.6.173.220","208.93.137.180","HTTP","393","GET /img/modules/siteheader/wea001/arrow.gif HTTP/1.1 "
"182","0.316803000","24.6.173.220","75.75.75.75","DNS","88","Standard query 0xbdc4  AAAA analytics.apnewsregistry.com"
"183","0.316804000","24.6.173.220","75.75.75.75","DNS","75","Standard query 0x00b7  AAAA imgs.sfgate.com"
"184","0.317004000","24.6.173.220","75.75.75.75","DNS","88","Standard query 0x2b9a  AAAA us2widget.nimblecommerce.com"
"185","0.318640000","208.93.137.180","24.6.173.220","HTTP","630","HTTP/1.1 200 OK  (application/x-javascript)"
"186","0.319041000","24.6.173.220","208.93.137.180","TCP","54","10619 > 80 [ACK] Seq=618 Ack=7558 Win=65700 Len=0"
"187","0.319475000","24.6.173.220","208.93.137.180","HTTP","389","GET /img/modules/siteheader/closeBtn.gif HTTP/1.1 "
"188","0.319793000","208.93.137.180","24.6.173.220","TCP","1514","[TCP segment of a reassembled PDU]"
"189","0.319797000","208.93.137.180","24.6.173.220","HTTP","903","HTTP/1.1 200 OK  (application/x-javascript)"
"190","0.320661000","24.6.173.220","208.93.137.180","TCP","54","10617 > 80 [ACK] Seq=940 Ack=21119 Win=65700 Len=0"
"191","0.320960000","24.6.173.220","208.93.137.180","HTTP","403","GET /img/partners/target/target_weekly_ad_animated.gif HTTP/1.1 "
"192","0.328494000","208.93.137.180","24.6.173.220","TCP","1514","[TCP segment of a reassembled PDU]"
"193","0.329492000","208.93.137.180","24.6.173.220","TCP","1514","[TCP segment of a reassembled PDU]"
"194","0.329495000","208.93.137.180","24.6.173.220","HTTP","975","HTTP/1.1 200 OK  (GIF89a) (GIF89a) (image/gif)"
"195","0.329500000","208.93.137.180","24.6.173.220","TCP","60","80 > 10625 [ACK] Seq=1 Ack=291 Win=6912 Len=0"
"196","0.329515000","208.93.137.180","24.6.173.220","TCP","1514","[TCP segment of a reassembled PDU]"
"197","0.330020000","24.6.173.220","208.93.137.180","HTTP","376","GET /img/utils/rss_icon.png HTTP/1.1 "
"198","0.330714000","208.93.137.180","24.6.173.220","HTTP","686","HTTP/1.1 200 OK  (PNG)"
"199","0.330716000","208.93.137.180","24.6.173.220","HTTP","823","HTTP/1.1 200 OK  (application/x-javascript)"
"200","0.331061000","24.6.173.220","208.93.137.180","TCP","54","10620 > 80 [ACK] Seq=937 Ack=21712 Win=256960 Len=0"
"201","0.331354000","24.6.173.220","208.93.137.180","HTTP","402","GET /img/modules/slideshow/promo/wide/button-prev.gif HTTP/1.1 "
"202","0.335478000","208.93.137.180","24.6.173.220","TCP","1514","[TCP segment of a reassembled PDU]"
"203","0.335718000","24.6.173.220","208.93.137.180","TCP","54","10616 > 80 [ACK] Seq=330 Ack=18981 Win=65700 Len=0"
"204","0.336476000","208.93.137.180","24.6.173.220","TCP","1514","[TCP segment of a reassembled PDU]"
"205","0.336478000","208.93.137.180","24.6.173.220","TCP","1514","[TCP segment of a reassembled PDU]"
"206","0.336935000","24.6.173.220","208.93.137.180","TCP","54","10616 > 80 [ACK] Seq=330 Ack=21901 Win=65700 Len=0"
"207","0.337687000","208.93.137.180","24.6.173.220","TCP","1514","[TCP segment of a reassembled PDU]"
"208","0.337689000","208.93.137.180","24.6.173.220","TCP","1514","[TCP segment of a reassembled PDU]"
"209","0.337692000","75.75.75.75","24.6.173.220","DNS","209","Standard query response 0xbdc4  CNAME prod-tracking-http-89765270.us-east-1.elb.amazonaws.com"
"210","0.337697000","75.75.75.75","24.6.173.220","DNS","174","Standard query response 0xba50  CNAME orig-10055.hearst.cotcdn.net"
"211","0.337698000","75.75.75.75","24.6.173.220","DNS","174","Standard query response 0x01b9  CNAME orig-10055.hearst.cotcdn.net"
"212","0.338260000","24.6.173.220","208.93.137.180","TCP","54","10616 > 80 [ACK] Seq=330 Ack=24821 Win=65700 Len=0"
"213","0.339137000","75.75.75.75","24.6.173.220","DNS","174","Standard query response 0xf57e  CNAME orig-10055.hearst.cotcdn.net"
"214","0.339153000","24.6.173.220","208.93.137.180","TCP","66","10627 > 80 [SYN] Seq=0 Win=8192 Len=0 MSS=1460 WS=4 SACK_PERM=1"
"215","0.339446000","24.6.173.220","208.93.137.180","TCP","66","10628 > 80 [SYN] Seq=0 Win=8192 Len=0 MSS=1460 WS=4 SACK_PERM=1"
"216","0.339678000","24.6.173.220","208.93.137.180","TCP","66","10629 > 80 [SYN] Seq=0 Win=8192 Len=0 MSS=1460 WS=4 SACK_PERM=1"
"217","0.339991000","24.6.173.220","208.93.137.180","TCP","66","10630 > 80 [SYN] Seq=0 Win=8192 Len=0 MSS=1460 WS=4 SACK_PERM=1"
"218","0.340172000","24.6.173.220","208.93.137.180","TCP","66","10631 > 80 [SYN] Seq=0 Win=8192 Len=0 MSS=1460 WS=4 SACK_PERM=1"
"219","0.340414000","24.6.173.220","208.93.137.180","TCP","66","10632 > 80 [SYN] Seq=0 Win=8192 Len=0 MSS=1460 WS=4 SACK_PERM=1"
"220","0.340697000","24.6.173.220","208.93.137.180","TCP","66","10633 > 80 [SYN] Seq=0 Win=8192 Len=0 MSS=1460 WS=4 SACK_PERM=1"
"221","0.340709000","208.93.137.180","24.6.173.220","HTTP","455","HTTP/1.1 200 OK  (GIF89a) (GIF89a) (image/gif)"
"222","0.340901000","24.6.173.220","208.93.137.180","TCP","66","10634 > 80 [SYN] Seq=0 Win=8192 Len=0 MSS=1460 WS=4 SACK_PERM=1"
"223","0.341221000","24.6.173.220","107.22.233.219","TCP","66","10635 > 80 [SYN] Seq=0 Win=8192 Len=0 MSS=1460 WS=4 SACK_PERM=1"
"224","0.341409000","24.6.173.220","208.93.137.180","TCP","66","10636 > 80 [SYN] Seq=0 Win=8192 Len=0 MSS=1460 WS=4 SACK_PERM=1"
"225","0.341650000","24.6.173.220","107.22.233.219","TCP","66","10637 > 80 [SYN] Seq=0 Win=8192 Len=0 MSS=1460 WS=4 SACK_PERM=1"
"226","0.341673000","208.93.137.180","24.6.173.220","HTTP","585","HTTP/1.1 200 OK  (GIF89a) (GIF89a) (image/gif)"
"227","0.341854000","24.6.173.220","208.93.137.180","TCP","66","10638 > 80 [SYN] Seq=0 Win=8192 Len=0 MSS=1460 WS=4 SACK_PERM=1"
"228","0.342222000","24.6.173.220","208.93.137.180","TCP","66","10639 > 80 [SYN] Seq=0 Win=8192 Len=0 MSS=1460 WS=4 SACK_PERM=1"
"229","0.342471000","24.6.173.220","208.93.137.180","TCP","66","10640 > 80 [SYN] Seq=0 Win=8192 Len=0 MSS=1460 WS=4 SACK_PERM=1"
"230","0.342589000","208.93.137.180","24.6.173.220","TCP","1514","[TCP segment of a reassembled PDU]"
"231","0.342592000","208.93.137.180","24.6.173.220","TCP","1514","[TCP segment of a reassembled PDU]"
"232","0.342598000","208.93.137.180","24.6.173.220","TCP","1514","[TCP segment of a reassembled PDU]"
"233","0.342600000","208.93.137.180","24.6.173.220","TCP","1514","[TCP segment of a reassembled PDU]"
"234","0.342823000","24.6.173.220","208.93.137.180","HTTP","402","GET /img/modules/slideshow/promo/wide/button-next.gif HTTP/1.1 "
"235","0.342824000","24.6.173.220","208.93.137.180","TCP","54","10617 > 80 [ACK] Seq=1289 Ack=26959 Win=65700 Len=0"
"236","0.343603000","208.93.137.180","24.6.173.220","TCP","1514","[TCP segment of a reassembled PDU]"
"237","0.344419000","208.93.137.180","24.6.173.220","TCP","1514","[TCP segment of a reassembled PDU]"
"238","0.344426000","208.93.137.180","24.6.173.220","TCP","1514","[TCP segment of a reassembled PDU]"
"239","0.344429000","208.93.137.180","24.6.173.220","TCP","1514","[TCP segment of a reassembled PDU]"
"240","0.344628000","24.6.173.220","208.93.137.180","TCP","54","10617 > 80 [ACK] Seq=1289 Ack=32799 Win=65700 Len=0"
"241","0.345438000","208.93.137.180","24.6.173.220","TCP","1514","[TCP segment of a reassembled PDU]"
"242","0.345440000","208.93.137.180","24.6.173.220","TCP","1514","[TCP segment of a reassembled PDU]"
"243","0.345509000","24.6.173.220","208.93.137.180","TCP","54","10617 > 80 [ACK] Seq=1289 Ack=35719 Win=65700 Len=0"
"244","0.346331000","208.93.137.180","24.6.173.220","TCP","1514","[TCP segment of a reassembled PDU]"
"245","0.346333000","208.93.137.180","24.6.173.220","TCP","1514","[TCP segment of a reassembled PDU]"
"246","0.346396000","24.6.173.220","208.93.137.180","TCP","54","10617 > 80 [ACK] Seq=1289 Ack=38639 Win=65700 Len=0"
"247","0.347153000","208.93.137.180","24.6.173.220","TCP","1514","[TCP segment of a reassembled PDU]"
"248","0.347157000","208.93.137.180","24.6.173.220","TCP","1514","[TCP segment of a reassembled PDU]"
"249","0.347226000","24.6.173.220","208.93.137.180","TCP","54","10617 > 80 [ACK] Seq=1289 Ack=41559 Win=65700 Len=0"
"250","0.348043000","208.93.137.180","24.6.173.220","TCP","1514","[TCP segment of a reassembled PDU]"
"251","0.348046000","208.93.137.180","24.6.173.220","TCP","1514","[TCP segment of a reassembled PDU]"
"252","0.348110000","24.6.173.220","208.93.137.180","TCP","54","10617 > 80 [ACK] Seq=1289 Ack=44479 Win=65700 Len=0"
"253","0.348229000","24.6.173.220","75.75.75.75","DNS","75","Standard query 0x00b7  AAAA imgs.sfgate.com"
"254","0.348883000","208.93.137.180","24.6.173.220","TCP","1514","[TCP segment of a reassembled PDU]"
"255","0.348885000","208.93.137.180","24.6.173.220","TCP","1514","[TCP segment of a reassembled PDU]"
"256","0.348953000","24.6.173.220","208.93.137.180","TCP","54","10617 > 80 [ACK] Seq=1289 Ack=47399 Win=65700 Len=0"
"257","0.349127000","24.6.173.220","75.75.75.75","DNS","88","Standard query 0x2b9a  AAAA us2widget.nimblecommerce.com"
"258","0.349709000","208.93.137.180","24.6.173.220","TCP","1514","[TCP segment of a reassembled PDU]"
"259","0.350511000","208.93.137.180","24.6.173.220","TCP","1514","[TCP segment of a reassembled PDU]"
"260","0.350514000","208.93.137.180","24.6.173.220","TCP","1514","[TCP segment of a reassembled PDU]"
"261","0.350516000","208.93.137.180","24.6.173.220","TCP","1514","[TCP segment of a reassembled PDU]"
"262","0.350575000","24.6.173.220","208.93.137.180","TCP","54","10617 > 80 [ACK] Seq=1289 Ack=53239 Win=65700 Len=0"
"263","0.351322000","208.93.137.180","24.6.173.220","HTTP","576","HTTP/1.1 200 OK  (GIF89a) (GIF89a) (image/gif)"
"264","0.351323000","75.75.75.75","24.6.173.220","DNS","176","Standard query response 0x00b7  CNAME orig-10056.hearst.cotcdn.net"
"265","0.351325000","75.75.75.75","24.6.173.220","DNS","199","Standard query response 0x2b9a  CNAME www1nc-1174862120.us-east-1.elb.amazonaws.com"
"266","0.351326000","208.93.137.180","24.6.173.220","HTTP","1108","HTTP/1.1 200 OK  (PNG)"
"267","0.352223000","24.6.173.220","184.73.197.77","TCP","66","10641 > 80 [SYN] Seq=0 Win=8192 Len=0 MSS=1460 WS=4 SACK_PERM=1"
"268","0.352462000","208.93.137.180","24.6.173.220","HTTP","817","HTTP/1.1 200 OK  (GIF89a) (GIF89a) (image/gif)"
"269","0.352643000","24.6.173.220","184.73.197.77","TCP","66","10642 > 80 [SYN] Seq=0 Win=8192 Len=0 MSS=1460 WS=4 SACK_PERM=1"
"270","0.353018000","24.6.173.220","208.93.137.190","TCP","66","10643 > 80 [SYN] Seq=0 Win=8192 Len=0 MSS=1460 WS=4 SACK_PERM=1"
"271","0.353213000","24.6.173.220","208.93.137.190","TCP","66","10644 > 80 [SYN] Seq=0 Win=8192 Len=0 MSS=1460 WS=4 SACK_PERM=1"
"272","0.356863000","208.93.137.180","24.6.173.220","TCP","1514","[TCP segment of a reassembled PDU]"
"273","0.357865000","208.93.137.180","24.6.173.220","TCP","1514","[TCP segment of a reassembled PDU]"
"274","0.357869000","208.93.137.180","24.6.173.220","HTTP","130","HTTP/1.1 200 OK  (text/css)"
"275","0.358083000","24.6.173.220","208.93.137.180","TCP","54","10616 > 80 [ACK] Seq=330 Ack=27817 Win=65700 Len=0"
"276","0.361736000","208.93.137.180","24.6.173.220","TCP","66","80 > 10627 [SYN, ACK] Seq=0 Ack=1 Win=5840 Len=0 MSS=1460 SACK_PERM=1 WS=128"
"277","0.361858000","24.6.173.220","208.93.137.180","TCP","54","10627 > 80 [ACK] Seq=1 Ack=1 Win=65700 Len=0"
"278","0.362246000","24.6.173.220","208.93.137.180","HTTP","401","GET /photos/16/01/46/3676557/5/square_horiz_promo.jpg HTTP/1.1 "
"279","0.362625000","208.93.137.180","24.6.173.220","TCP","66","80 > 10628 [SYN, ACK] Seq=0 Ack=1 Win=5840 Len=0 MSS=1460 SACK_PERM=1 WS=128"
"280","0.362626000","208.93.137.180","24.6.173.220","TCP","66","80 > 10629 [SYN, ACK] Seq=0 Ack=1 Win=5840 Len=0 MSS=1460 SACK_PERM=1 WS=128"
"281","0.362627000","208.93.137.180","24.6.173.220","TCP","66","80 > 10630 [SYN, ACK] Seq=0 Ack=1 Win=5840 Len=0 MSS=1460 SACK_PERM=1 WS=128"
"282","0.362629000","208.93.137.180","24.6.173.220","TCP","66","80 > 10640 [SYN, ACK] Seq=0 Ack=1 Win=5840 Len=0 MSS=1460 SACK_PERM=1 WS=128"
"283","0.362630000","208.93.137.180","24.6.173.220","TCP","66","80 > 10639 [SYN, ACK] Seq=0 Ack=1 Win=5840 Len=0 MSS=1460 SACK_PERM=1 WS=128"
"284","0.362632000","208.93.137.180","24.6.173.220","TCP","66","80 > 10631 [SYN, ACK] Seq=0 Ack=1 Win=5840 Len=0 MSS=1460 SACK_PERM=1 WS=128"
"285","0.362633000","208.93.137.180","24.6.173.220","TCP","66","80 > 10633 [SYN, ACK] Seq=0 Ack=1 Win=5840 Len=0 MSS=1460 SACK_PERM=1 WS=128"
"286","0.362635000","208.93.137.180","24.6.173.220","TCP","66","80 > 10632 [SYN, ACK] Seq=0 Ack=1 Win=5840 Len=0 MSS=1460 SACK_PERM=1 WS=128"
"287","0.362636000","208.93.137.180","24.6.173.220","TCP","66","80 > 10636 [SYN, ACK] Seq=0 Ack=1 Win=5840 Len=0 MSS=1460 SACK_PERM=1 WS=128"
"288","0.362638000","208.93.137.180","24.6.173.220","TCP","66","80 > 10634 [SYN, ACK] Seq=0 Ack=1 Win=5840 Len=0 MSS=1460 SACK_PERM=1 WS=128"
"289","0.362641000","208.93.137.180","24.6.173.220","TCP","66","80 > 10638 [SYN, ACK] Seq=0 Ack=1 Win=5840 Len=0 MSS=1460 SACK_PERM=1 WS=128"
"290","0.362990000","24.6.173.220","208.93.137.180","HTTP","395","GET /photos/16/02/37/3680253/3/blockstates2.jpg HTTP/1.1 "
"291","0.362994000","24.6.173.220","208.93.137.180","TCP","54","10629 > 80 [ACK] Seq=1 Ack=1 Win=65700 Len=0"
"292","0.363020000","24.6.173.220","208.93.137.180","TCP","54","10630 > 80 [ACK] Seq=1 Ack=1 Win=65700 Len=0"
"293","0.363040000","24.6.173.220","208.93.137.180","TCP","54","10640 > 80 [ACK] Seq=1 Ack=1 Win=65700 Len=0"
"294","0.363062000","24.6.173.220","208.93.137.180","TCP","54","10639 > 80 [ACK] Seq=1 Ack=1 Win=65700 Len=0"
"295","0.363081000","24.6.173.220","208.93.137.180","TCP","54","10631 > 80 [ACK] Seq=1 Ack=1 Win=65700 Len=0"
"296","0.363101000","24.6.173.220","208.93.137.180","TCP","54","10633 > 80 [ACK] Seq=1 Ack=1 Win=65700 Len=0"
"297","0.363123000","24.6.173.220","208.93.137.180","TCP","54","10632 > 80 [ACK] Seq=1 Ack=1 Win=65700 Len=0"
"298","0.363142000","24.6.173.220","208.93.137.180","TCP","54","10636 > 80 [ACK] Seq=1 Ack=1 Win=65700 Len=0"
"299","0.363163000","24.6.173.220","208.93.137.180","TCP","54","10634 > 80 [ACK] Seq=1 Ack=1 Win=65700 Len=0"
"300","0.363184000","24.6.173.220","208.93.137.180","TCP","54","10638 > 80 [ACK] Seq=1 Ack=1 Win=65700 Len=0"
"301","0.363304000","24.6.173.220","208.93.137.180","HTTP","395","GET /photos/16/01/41/3676237/5/blockstates2.jpg HTTP/1.1 "
"302","0.363866000","24.6.173.220","208.93.137.180","HTTP","401","GET /photos/16/02/34/3680004/3/square_horiz_promo.jpg HTTP/1.1 "
"303","0.364151000","24.6.173.220","208.93.137.180","HTTP","395","GET /photos/16/01/31/3675736/3/blockstates2.jpg HTTP/1.1 "
"304","0.364679000","24.6.173.220","208.93.137.180","HTTP","401","GET /photos/16/02/35/3680074/3/square_horiz_promo.jpg HTTP/1.1 "
"305","0.368828000","75.75.75.75","24.6.173.220","DNS","199","Standard query response 0x2b9a  CNAME www1nc-1174862120.us-east-1.elb.amazonaws.com"
"306","0.373042000","208.93.137.190","24.6.173.220","TCP","66","80 > 10644 [SYN, ACK] Seq=0 Ack=1 Win=5840 Len=0 MSS=1460 SACK_PERM=1 WS=128"
"307","0.373190000","24.6.173.220","208.93.137.190","TCP","54","10644 > 80 [ACK] Seq=1 Ack=1 Win=65700 Len=0"
"308","0.373581000","24.6.173.220","208.93.137.190","HTTP","385","GET /graphics/utils/hearst_logo.gif HTTP/1.1 "
"309","0.373983000","208.93.137.190","24.6.173.220","TCP","66","80 > 10643 [SYN, ACK] Seq=0 Ack=1 Win=5840 Len=0 MSS=1460 SACK_PERM=1 WS=128"
"310","0.373986000","208.93.137.180","24.6.173.220","HTTP","817","HTTP/1.1 200 OK  (GIF89a) (GIF89a) (image/gif)"
"311","0.374313000","24.6.173.220","208.93.137.190","TCP","54","10643 > 80 [ACK] Seq=1 Ack=1 Win=65700 Len=0"
"312","0.375812000","75.75.75.75","24.6.173.220","DNS","176","Standard query response 0x00b7  CNAME orig-10056.hearst.cotcdn.net"
"313","0.379716000","66.109.241.50","24.6.173.220","TCP","66","80 > 10622 [SYN, ACK] Seq=0 Ack=1 Win=16384 Len=0 MSS=1380 WS=1 SACK_PERM=1"
"314","0.379847000","24.6.173.220","66.109.241.50","TCP","54","10622 > 80 [ACK] Seq=1 Ack=1 Win=66240 Len=0"
"315","0.380407000","24.6.173.220","66.109.241.50","HTTP","373","GET /css/modal.css HTTP/1.1 "
"316","0.380634000","66.109.241.50","24.6.173.220","TCP","66","80 > 10623 [SYN, ACK] Seq=0 Ack=1 Win=16384 Len=0 MSS=1380 WS=1 SACK_PERM=1"
"317","0.380635000","66.109.241.50","24.6.173.220","TCP","66","80 > 10624 [SYN, ACK] Seq=0 Ack=1 Win=16384 Len=0 MSS=1380 WS=1 SACK_PERM=1"
"318","0.380637000","66.109.241.50","24.6.173.220","TCP","66","80 > 10621 [SYN, ACK] Seq=0 Ack=1 Win=16384 Len=0 MSS=1380 WS=1 SACK_PERM=1"
"319","0.380778000","24.6.173.220","66.109.241.50","TCP","54","10623 > 80 [ACK] Seq=1 Ack=1 Win=66240 Len=0"
"320","0.380803000","24.6.173.220","66.109.241.50","TCP","54","10624 > 80 [ACK] Seq=1 Ack=1 Win=66240 Len=0"
"321","0.380823000","24.6.173.220","66.109.241.50","TCP","54","10621 > 80 [ACK] Seq=1 Ack=1 Win=66240 Len=0"
"322","0.381144000","24.6.173.220","66.109.241.50","HTTP","369","GET /js/jquery.digitaldoor.js HTTP/1.1 "
"323","0.385569000","208.93.137.180","24.6.173.220","TCP","60","80 > 10627 [ACK] Seq=1 Ack=348 Win=6912 Len=0"
"324","0.386659000","208.93.137.180","24.6.173.220","TCP","1514","[TCP segment of a reassembled PDU]"
"325","0.387710000","208.93.137.180","24.6.173.220","HTTP","668","HTTP/1.1 200 OK  (JPEG JFIF image)"
"326","0.387718000","208.93.137.180","24.6.173.220","TCP","60","80 > 10628 [ACK] Seq=1 Ack=342 Win=6912 Len=0"
"327","0.387719000","208.93.137.180","24.6.173.220","TCP","60","80 > 10629 [ACK] Seq=1 Ack=342 Win=6912 Len=0"
"328","0.387723000","208.93.137.180","24.6.173.220","TCP","60","80 > 10634 [ACK] Seq=1 Ack=348 Win=6912 Len=0"
"329","0.387725000","208.93.137.180","24.6.173.220","TCP","60","80 > 10638 [ACK] Seq=1 Ack=342 Win=6912 Len=0"
"330","0.387726000","208.93.137.180","24.6.173.220","TCP","1514","[TCP segment of a reassembled PDU]"
"331","0.387729000","208.93.137.180","24.6.173.220","TCP","1514","[TCP segment of a reassembled PDU]"
"332","0.388053000","24.6.173.220","208.93.137.180","TCP","54","10627 > 80 [ACK] Seq=348 Ack=2075 Win=65700 Len=0"
"333","0.388080000","24.6.173.220","208.93.137.180","TCP","54","10628 > 80 [ACK] Seq=342 Ack=2921 Win=65700 Len=0"
"334","0.388832000","208.93.137.180","24.6.173.220","TCP","1514","[TCP segment of a reassembled PDU]"
"335","0.388834000","208.93.137.180","24.6.173.220","TCP","1514","[TCP segment of a reassembled PDU]"
"336","0.388938000","24.6.173.220","208.93.137.180","TCP","54","10628 > 80 [ACK] Seq=342 Ack=5841 Win=65700 Len=0"
"337","0.389742000","208.93.137.180","24.6.173.220","TCP","1514","[TCP segment of a reassembled PDU]"
"338","0.389744000","208.93.137.180","24.6.173.220","TCP","1514","[TCP segment of a reassembled PDU]"
"339","0.389860000","24.6.173.220","208.93.137.180","TCP","54","10628 > 80 [ACK] Seq=342 Ack=8761 Win=65700 Len=0"
"340","0.390620000","208.93.137.180","24.6.173.220","TCP","1514","[TCP segment of a reassembled PDU]"
"341","0.390623000","208.93.137.180","24.6.173.220","TCP","60","80 > 10639 [ACK] Seq=1 Ack=348 Win=6912 Len=0"
"342","0.390624000","208.93.137.180","24.6.173.220","TCP","1514","[TCP segment of a reassembled PDU]"
"343","0.390737000","24.6.173.220","208.93.137.180","TCP","54","10628 > 80 [ACK] Seq=342 Ack=11681 Win=65700 Len=0"
"344","0.391488000","208.93.137.180","24.6.173.220","TCP","1514","[TCP segment of a reassembled PDU]"
"345","0.391490000","208.93.137.180","24.6.173.220","TCP","1514","[TCP segment of a reassembled PDU]"
"346","0.391655000","24.6.173.220","208.93.137.180","TCP","54","10628 > 80 [ACK] Seq=342 Ack=14601 Win=65700 Len=0"
"347","0.392412000","208.93.137.180","24.6.173.220","TCP","1514","[TCP segment of a reassembled PDU]"
"348","0.392415000","208.93.137.180","24.6.173.220","TCP","1514","[TCP segment of a reassembled PDU]"
"349","0.392600000","24.6.173.220","208.93.137.180","TCP","54","10628 > 80 [ACK] Seq=342 Ack=17521 Win=65700 Len=0"
"350","0.393355000","208.93.137.180","24.6.173.220","TCP","1514","[TCP segment of a reassembled PDU]"
