No.,Time,Source,Destination,Protocol,Length,Info
1,0,24.6.173.220,75.75.75.75,DNS,74,Standard query 0x5285  A www.sfgate.com
2,0.012983,75.75.75.75,24.6.173.220,DNS,132,Standard query response 0x5285  CNAME orig-10034.hearst.cotcdn.net A 208.93.137.180
3,0.014193,24.6.173.220,75.75.75.75,DNS,74,Standard query 0x30b7  AAAA www.sfgate.com
4,0.034265,75.75.75.75,24.6.173.220,DNS,175,Standard query response 0x30b7  CNAME orig-10034.hearst.cotcdn.net
5,0.035587,24.6.173.220,208.93.137.180,TCP,66,10615 > 80 [SYN] Seq=0 Win=8192 Len=0 MSS=1460 WS=4 SACK_PERM=1
6,0.053914,208.93.137.180,24.6.173.220,TCP,66,"80 > 10615 [SYN, ACK] Seq=0 Ack=1 Win=5840 Len=0 MSS=1460 SACK_PERM=1 WS=128"
7,0.054046,24.6.173.220,208.93.137.180,TCP,54,10615 > 80 [ACK] Seq=1 Ack=1 Win=65700 Len=0
8,0.054566,24.6.173.220,208.93.137.180,HTTP,549,GET /feedback/ HTTP/1.1 
9,0.07576,208.93.137.180,24.6.173.220,TCP,60,80 > 10615 [ACK] Seq=1 Ack=496 Win=6912 Len=0
10,0.198335,208.93.137.180,24.6.173.220,TCP,1514,[TCP segment of a reassembled PDU]
11,0.20052,208.93.137.180,24.6.173.220,TCP,1514,[TCP segment of a reassembled PDU]
12,0.20218,24.6.173.220,208.93.137.180,TCP,54,10615 > 80 [ACK] Seq=496 Ack=2921 Win=65700 Len=0
13,0.228194,24.6.173.220,208.93.137.180,TCP,66,10616 > 80 [SYN] Seq=0 Win=8192 Len=0 MSS=1460 WS=4 SACK_PERM=1
14,0.229065,24.6.173.220,208.93.137.180,TCP,66,10617 > 80 [SYN] Seq=0 Win=8192 Len=0 MSS=1460 WS=4 SACK_PERM=1
15,0.229307,24.6.173.220,208.93.137.180,TCP,66,10618 > 80 [SYN] Seq=0 Win=8192 Len=0 MSS=1460 WS=4 SACK_PERM=1
16,0.229807,24.6.173.220,75.75.75.75,DNS,76,Standard query 0xbb19  A aps.hearstnp.com
17,0.229919,24.6.173.220,208.93.137.180,TCP,66,10619 > 80 [SYN] Seq=0 Win=8192 Len=0 MSS=1460 WS=4 SACK_PERM=1
18,0.23037,24.6.173.220,208.93.137.180,TCP,66,10620 > 80 [SYN] Seq=0 Win=8192 Len=0 MSS=1460 WS=4 SACK_PERM=1
19,0.230395,24.6.173.220,75.75.75.75,DNS,95,Standard query 0x86c3  A digitaldoor.subscriberconcierge.com
20,0.243244,208.93.137.180,24.6.173.220,TCP,1514,[TCP segment of a reassembled PDU]
21,0.245418,208.93.137.180,24.6.173.220,TCP,1514,[TCP segment of a reassembled PDU]
22,0.245423,208.93.137.180,24.6.173.220,TCP,1514,[TCP segment of a reassembled PDU]
23,0.245425,208.93.137.180,24.6.173.220,TCP,1514,[TCP segment of a reassembled PDU]
24,0.247747,24.6.173.220,208.93.137.180,TCP,54,10615 > 80 [ACK] Seq=496 Ack=8761 Win=65700 Len=0
25,0.248535,208.93.137.180,24.6.173.220,TCP,66,"80 > 10616 [SYN, ACK] Seq=0 Ack=1 Win=5840 Len=0 MSS=1460 SACK_PERM=1 WS=128"
26,0.248536,208.93.137.180,24.6.173.220,TCP,66,"80 > 10617 [SYN, ACK] Seq=0 Ack=1 Win=5840 Len=0 MSS=1460 SACK_PERM=1 WS=128"
27,0.248538,208.93.137.180,24.6.173.220,TCP,66,"80 > 10618 [SYN, ACK] Seq=0 Ack=1 Win=5840 Len=0 MSS=1460 SACK_PERM=1 WS=128"
28,0.24854,75.75.75.75,24.6.173.220,DNS,111,Standard query response 0x86c3  A 66.109.241.50
29,0.248541,75.75.75.75,24.6.173.220,DNS,134,Standard query response 0xbb19  CNAME orig-10050.hearst.cotcdn.net A 208.93.137.180
30,0.248727,24.6.173.220,208.93.137.180,TCP,54,10616 > 80 [ACK] Seq=1 Ack=1 Win=65700 Len=0
31,0.248773,24.6.173.220,208.93.137.180,TCP,54,10617 > 80 [ACK] Seq=1 Ack=1 Win=65700 Len=0
32,0.248798,24.6.173.220,208.93.137.180,TCP,54,10618 > 80 [ACK] Seq=1 Ack=1 Win=65700 Len=0
33,0.249392,24.6.173.220,208.93.137.180,HTTP,383,GET /external/css/global.shared.2.8.4p3.19000.css HTTP/1.1 
34,0.249817,24.6.173.220,208.93.137.180,HTTP,381,GET /external/css/global.site.2.8.4p3.19000.css HTTP/1.1 
35,0.249818,24.6.173.220,75.75.75.75,DNS,76,Standard query 0xd557  AAAA aps.hearstnp.com
36,0.249841,24.6.173.220,75.75.75.75,DNS,95,Standard query 0xe6fc  AAAA digitaldoor.subscriberconcierge.com
37,0.250116,24.6.173.220,208.93.137.180,HTTP,366,GET /external/js/global.header.2.8.4p3.19000.js HTTP/1.1 
38,0.251332,208.93.137.180,24.6.173.220,TCP,66,"80 > 10619 [SYN, ACK] Seq=0 Ack=1 Win=5840 Len=0 MSS=1460 SACK_PERM=1 WS=128"
39,0.251334,208.93.137.180,24.6.173.220,TCP,60,"80 > 10620 [SYN, ACK] Seq=0 Ack=1 Win=5840 Len=0 MSS=1460"
40,0.251444,24.6.173.220,208.93.137.180,TCP,54,10619 > 80 [ACK] Seq=1 Ack=1 Win=65700 Len=0
41,0.251473,24.6.173.220,208.93.137.180,TCP,54,10620 > 80 [ACK] Seq=1 Ack=1 Win=256960 Len=0
42,0.251759,24.6.173.220,208.93.137.180,HTTP,370,GET /css/pages/sections/feedback.css HTTP/1.1 
43,0.25217,24.6.173.220,208.93.137.180,HTTP,363,GET /external/js/global.top.2.8.4p3.19000.js HTTP/1.1 
44,0.267873,208.93.137.180,24.6.173.220,TCP,60,80 > 10616 [ACK] Seq=1 Ack=330 Win=6912 Len=0
45,0.268632,208.93.137.180,24.6.173.220,TCP,1514,[TCP segment of a reassembled PDU]
46,0.269652,208.93.137.180,24.6.173.220,TCP,1514,[TCP segment of a reassembled PDU]
47,0.269655,208.93.137.180,24.6.173.220,TCP,1514,[TCP segment of a reassembled PDU]
48,0.269657,208.93.137.180,24.6.173.220,TCP,60,80 > 10617 [ACK] Seq=1 Ack=328 Win=6912 Len=0
49,0.269662,208.93.137.180,24.6.173.220,TCP,1514,[TCP segment of a reassembled PDU]
50,0.270234,24.6.173.220,208.93.137.180,TCP,54,10616 > 80 [ACK] Seq=330 Ack=4381 Win=65700 Len=0
51,0.270997,208.93.137.180,24.6.173.220,TCP,1514,[TCP segment of a reassembled PDU]
52,0.271,208.93.137.180,24.6.173.220,TCP,1514,[TCP segment of a reassembled PDU]
53,0.271369,24.6.173.220,208.93.137.180,TCP,54,10617 > 80 [ACK] Seq=328 Ack=4381 Win=65700 Len=0
54,0.272172,208.93.137.180,24.6.173.220,TCP,1514,[TCP segment of a reassembled PDU]
55,0.272174,208.93.137.180,24.6.173.220,TCP,1514,[TCP segment of a reassembled PDU]
56,0.272178,208.93.137.180,24.6.173.220,TCP,1514,[TCP segment of a reassembled PDU]
57,0.272864,24.6.173.220,208.93.137.180,TCP,54,10617 > 80 [ACK] Seq=328 Ack=8761 Win=65700 Len=0
58,0.273613,208.93.137.180,24.6.173.220,TCP,1514,[TCP segment of a reassembled PDU]
59,0.273615,208.93.137.180,24.6.173.220,TCP,1514,[TCP segment of a reassembled PDU]
60,0.273622,208.93.137.180,24.6.173.220,TCP,1514,[TCP segment of a reassembled PDU]
61,0.274192,24.6.173.220,208.93.137.180,TCP,54,10617 > 80 [ACK] Seq=328 Ack=13141 Win=65700 Len=0
62,0.27494,208.93.137.180,24.6.173.220,TCP,1514,[TCP segment of a reassembled PDU]
63,0.274942,208.93.137.180,24.6.173.220,TCP,1514,[TCP segment of a reassembled PDU]
64,0.274945,208.93.137.180,24.6.173.220,TCP,1514,[TCP segment of a reassembled PDU]
65,0.27495,208.93.137.180,24.6.173.220,HTTP,472,HTTP/1.1 200 OK  (text/css)
66,0.274955,75.75.75.75,24.6.173.220,DNS,150,Standard query response 0xe6fc 
67,0.275594,24.6.173.220,208.93.137.180,TCP,54,10617 > 80 [ACK] Seq=328 Ack=17939 Win=65700 Len=0
68,0.27599,24.6.173.220,208.93.137.180,HTTP,354,GET /js/omniture/analyticsconfig.js HTTP/1.1 
69,0.276325,24.6.173.220,66.109.241.50,TCP,66,10621 > 80 [SYN] Seq=0 Win=8192 Len=0 MSS=1460 WS=4 SACK_PERM=1
70,0.276463,208.93.137.180,24.6.173.220,TCP,60,80 > 10618 [ACK] Seq=1 Ack=313 Win=6912 Len=0
71,0.276478,208.93.137.180,24.6.173.220,TCP,60,80 > 10619 [ACK] Seq=1 Ack=317 Win=6912 Len=0
72,0.276479,208.93.137.180,24.6.173.220,TCP,60,80 > 10620 [ACK] Seq=1 Ack=310 Win=6432 Len=0
73,0.27648,208.93.137.180,24.6.173.220,HTTP,478,HTTP/1.1 200 OK  (application/x-javascript) (application/x-javascript)
74,0.276482,208.93.137.180,24.6.173.220,HTTP,1195,HTTP/1.1 200 OK  (text/css)
75,0.276483,208.93.137.180,24.6.173.220,TCP,1514,[TCP segment of a reassembled PDU]
76,0.276638,24.6.173.220,66.109.241.50,TCP,66,10622 > 80 [SYN] Seq=0 Win=8192 Len=0 MSS=1460 WS=4 SACK_PERM=1
77,0.277345,24.6.173.220,66.109.241.50,TCP,66,10623 > 80 [SYN] Seq=0 Win=8192 Len=0 MSS=1460 WS=4 SACK_PERM=1
78,0.277873,208.93.137.180,24.6.173.220,TCP,1514,[TCP segment of a reassembled PDU]
79,0.277876,208.93.137.180,24.6.173.220,TCP,1514,[TCP segment of a reassembled PDU]
80,0.277879,208.93.137.180,24.6.173.220,TCP,1514,[TCP segment of a reassembled PDU]
81,0.277884,208.93.137.180,24.6.173.220,TCP,1514,[TCP segment of a reassembled PDU]
82,0.278011,24.6.173.220,66.109.241.50,TCP,66,10624 > 80 [SYN] Seq=0 Win=8192 Len=0 MSS=1460 WS=4 SACK_PERM=1
83,0.278273,24.6.173.220,208.93.137.180,HTTP,349,GET /js/hdn/omniture/s_code.js HTTP/1.1 
84,0.278562,24.6.173.220,208.93.137.180,HTTP,355,GET /js/hdn/omniture/analyticswcm.js HTTP/1.1 
85,0.279293,24.6.173.220,208.93.137.180,TCP,54,10618 > 80 [ACK] Seq=313 Ack=7301 Win=65700 Len=0
86,0.28005,208.93.137.180,24.6.173.220,TCP,1514,[TCP segment of a reassembled PDU]
87,0.280053,208.93.137.180,24.6.173.220,TCP,1514,[TCP segment of a reassembled PDU]
88,0.280057,208.93.137.180,24.6.173.220,TCP,1514,[TCP segment of a reassembled PDU]
89,0.28006,208.93.137.180,24.6.173.220,TCP,1514,[TCP segment of a reassembled PDU]
90,0.281497,24.6.173.220,208.93.137.180,TCP,54,10618 > 80 [ACK] Seq=313 Ack=13141 Win=65700 Len=0
91,0.282254,208.93.137.180,24.6.173.220,TCP,1514,[TCP segment of a reassembled PDU]
92,0.282257,208.93.137.180,24.6.173.220,TCP,1514,[TCP segment of a reassembled PDU]
93,0.282262,208.93.137.180,24.6.173.220,TCP,1514,[TCP segment of a reassembled PDU]
94,0.282266,208.93.137.180,24.6.173.220,TCP,1514,[TCP segment of a reassembled PDU]
95,0.282268,208.93.137.180,24.6.173.220,TCP,1514,[TCP segment of a reassembled PDU]
96,0.284262,24.6.173.220,208.93.137.180,TCP,54,10618 > 80 [ACK] Seq=313 Ack=20441 Win=65700 Len=0
97,0.285017,208.93.137.180,24.6.173.220,TCP,1514,[TCP segment of a reassembled PDU]
98,0.28502,208.93.137.180,24.6.173.220,TCP,1514,[TCP segment of a reassembled PDU]
99,0.285024,208.93.137.180,24.6.173.220,TCP,1514,[TCP segment of a reassembled PDU]
100,0.285027,208.93.137.180,24.6.173.220,TCP,1514,[TCP segment of a reassembled PDU]
101,0.285029,208.93.137.180,24.6.173.220,TCP,1514,[TCP segment of a reassembled PDU]
102,0.285032,208.93.137.180,24.6.173.220,TCP,1514,[TCP segment of a reassembled PDU]
103,0.287745,24.6.173.220,208.93.137.180,TCP,54,10618 > 80 [ACK] Seq=313 Ack=29201 Win=65700 Len=0
104,0.288513,208.93.137.180,24.6.173.220,TCP,1514,[TCP segment of a reassembled PDU]
105,0.288515,208.93.137.180,24.6.173.220,TCP,1514,[TCP segment of a reassembled PDU]
106,0.288517,75.75.75.75,24.6.173.220,DNS,177,Standard query response 0xd557  CNAME orig-10050.hearst.cotcdn.net
107,0.288522,208.93.137.180,24.6.173.220,TCP,1514,[TCP segment of a reassembled PDU]
108,0.288537,208.93.137.180,24.6.173.220,TCP,1514,[TCP segment of a reassembled PDU]
109,0.288539,208.93.137.180,24.6.173.220,TCP,1514,[TCP segment of a reassembled PDU]
110,0.288545,208.93.137.180,24.6.173.220,TCP,1514,[TCP segment of a reassembled PDU]
111,0.289717,24.6.173.220,208.93.137.180,TCP,54,10618 > 80 [ACK] Seq=313 Ack=32121 Win=65700 Len=0
112,0.290641,24.6.173.220,208.93.137.180,TCP,54,10616 > 80 [ACK] Seq=330 Ack=10221 Win=65700 Len=0
113,0.29104,24.6.173.220,208.93.137.180,TCP,66,10625 > 80 [SYN] Seq=0 Win=8192 Len=0 MSS=1460 WS=4 SACK_PERM=1
114,0.291317,24.6.173.220,208.93.137.180,TCP,66,10626 > 80 [SYN] Seq=0 Win=8192 Len=0 MSS=1460 WS=4 SACK_PERM=1
115,0.291397,208.93.137.180,24.6.173.220,TCP,1514,[TCP segment of a reassembled PDU]
116,0.291399,208.93.137.180,24.6.173.220,TCP,1514,[TCP segment of a reassembled PDU]
117,0.291402,208.93.137.180,24.6.173.220,TCP,1514,[TCP segment of a reassembled PDU]
118,0.291408,208.93.137.180,24.6.173.220,TCP,1514,[TCP segment of a reassembled PDU]
119,0.29141,208.93.137.180,24.6.173.220,HTTP,891,HTTP/1.1 200 OK  (text/html)
120,0.294617,24.6.173.220,75.75.75.75,DNS,73,Standard query 0xf961  A ww3.hdnux.com
121,0.294864,24.6.173.220,75.75.75.75,DNS,73,Standard query 0x0273  A ww1.hdnux.com
122,0.295007,24.6.173.220,75.75.75.75,DNS,73,Standard query 0x7393  A ww2.hdnux.com
123,0.295086,24.6.173.220,208.93.137.180,TCP,54,10615 > 80 [ACK] Seq=496 Ack=15438 Win=65700 Len=0
124,0.295795,24.6.173.220,208.93.137.180,HTTP,344,GET /js/hdn/ysmwrapper.js HTTP/1.1 
125,0.297128,208.93.137.180,24.6.173.220,TCP,1514,[TCP segment of a reassembled PDU]
126,0.298611,208.93.137.180,24.6.173.220,HTTP,392,HTTP/1.1 200 OK  (application/x-javascript)
127,0.298613,208.93.137.180,24.6.173.220,TCP,1514,[TCP segment of a reassembled PDU]
128,0.298616,208.93.137.180,24.6.173.220,TCP,1514,[TCP segment of a reassembled PDU]
129,0.298618,208.93.137.180,24.6.173.220,TCP,1514,[TCP segment of a reassembled PDU]
130,0.298621,208.93.137.180,24.6.173.220,HTTP,925,HTTP/1.1 200 OK  (application/x-javascript)
131,0.298977,24.6.173.220,75.75.75.75,DNS,88,Standard query 0xcf9a  A us2widget.nimblecommerce.com
132,0.299642,24.6.173.220,75.75.75.75,DNS,88,Standard query 0xfe93  A analytics.apnewsregistry.com
133,0.299935,24.6.173.220,75.75.75.75,DNS,75,Standard query 0x6505  A imgs.sfgate.com
134,0.300282,24.6.173.220,208.93.137.180,TCP,54,10618 > 80 [ACK] Seq=313 Ack=33919 Win=65700 Len=0
135,0.30031,24.6.173.220,208.93.137.180,TCP,54,10619 > 80 [ACK] Seq=618 Ack=5522 Win=65700 Len=0
136,0.30102,24.6.173.220,208.93.137.180,HTTP,366,GET /external/js/global.bottom.2.8.4p3.19000.js HTTP/1.1 
137,0.301066,208.93.137.180,24.6.173.220,TCP,1514,[TCP segment of a reassembled PDU]
138,0.301068,208.93.137.180,24.6.173.220,TCP,1514,[TCP segment of a reassembled PDU]
139,0.301071,208.93.137.180,24.6.173.220,TCP,1514,[TCP segment of a reassembled PDU]
140,0.301073,208.93.137.180,24.6.173.220,TCP,1514,[TCP segment of a reassembled PDU]
141,0.301075,208.93.137.180,24.6.173.220,TCP,1514,[TCP segment of a reassembled PDU]
142,0.302561,24.6.173.220,208.93.137.180,TCP,54,10620 > 80 [ACK] Seq=605 Ack=6265 Win=256960 Len=0
143,0.303043,24.6.173.220,208.93.137.180,HTTP,395,GET /img/modules/siteheader/chron_we_promo.gif HTTP/1.1 
144,0.303365,208.93.137.180,24.6.173.220,TCP,1514,[TCP segment of a reassembled PDU]
145,0.303367,208.93.137.180,24.6.173.220,TCP,1514,[TCP segment of a reassembled PDU]
146,0.30337,208.93.137.180,24.6.173.220,TCP,1514,[TCP segment of a reassembled PDU]
147,0.303372,208.93.137.180,24.6.173.220,TCP,1514,[TCP segment of a reassembled PDU]
148,0.303374,208.93.137.180,24.6.173.220,TCP,1514,[TCP segment of a reassembled PDU]
149,0.304922,24.6.173.220,208.93.137.180,TCP,54,10620 > 80 [ACK] Seq=605 Ack=13565 Win=256960 Len=0
150,0.305737,208.93.137.180,24.6.173.220,TCP,1514,[TCP segment of a reassembled PDU]
151,0.30574,208.93.137.180,24.6.173.220,TCP,1514,[TCP segment of a reassembled PDU]
152,0.305743,208.93.137.180,24.6.173.220,TCP,1514,[TCP segment of a reassembled PDU]
153,0.305745,208.93.137.180,24.6.173.220,TCP,1514,[TCP segment of a reassembled PDU]
154,0.305747,208.93.137.180,24.6.173.220,HTTP,269,HTTP/1.1 200 OK  (application/x-javascript)
155,0.307071,24.6.173.220,208.93.137.180,TCP,54,10620 > 80 [ACK] Seq=605 Ack=19620 Win=256960 Len=0
156,0.307355,24.6.173.220,208.93.137.180,HTTP,386,GET /img/modules/siteheader/brand.png HTTP/1.1 
157,0.308581,208.93.137.180,24.6.173.220,TCP,66,"80 > 10625 [SYN, ACK] Seq=0 Ack=1 Win=5840 Len=0 MSS=1460 SACK_PERM=1 WS=128"
158,0.308806,24.6.173.220,208.93.137.180,TCP,54,10625 > 80 [ACK] Seq=1 Ack=1 Win=65700 Len=0
159,0.309161,24.6.173.220,208.93.137.180,HTTP,344,GET /Scripts/loadAds.js HTTP/1.1 
160,0.309558,208.93.137.180,24.6.173.220,TCP,1514,[TCP segment of a reassembled PDU]
161,0.30956,208.93.137.180,24.6.173.220,TCP,66,"80 > 10626 [SYN, ACK] Seq=0 Ack=1 Win=5840 Len=0 MSS=1460 SACK_PERM=1 WS=128"
162,0.309793,24.6.173.220,208.93.137.180,TCP,54,10626 > 80 [ACK] Seq=1 Ack=1 Win=65700 Len=0
163,0.310548,208.93.137.180,24.6.173.220,TCP,1514,[TCP segment of a reassembled PDU]
164,0.310552,208.93.137.180,24.6.173.220,TCP,1514,[TCP segment of a reassembled PDU]
165,0.310554,208.93.137.180,24.6.173.220,TCP,1514,[TCP segment of a reassembled PDU]
166,0.311122,24.6.173.220,208.93.137.180,TCP,54,10616 > 80 [ACK] Seq=330 Ack=16061 Win=65700 Len=0
167,0.311871,208.93.137.180,24.6.173.220,TCP,1514,[TCP segment of a reassembled PDU]
168,0.311874,75.75.75.75,24.6.173.220,DNS,131,Standard query response 0x0273  CNAME orig-10055.hearst.cotcdn.net A 208.93.137.180
169,0.311875,75.75.75.75,24.6.173.220,DNS,131,Standard query response 0xf961  CNAME orig-10055.hearst.cotcdn.net A 208.93.137.180
170,0.311877,75.75.75.75,24.6.173.220,DNS,131,Standard query response 0x7393  CNAME orig-10055.hearst.cotcdn.net A 208.93.137.180
171,0.31288,24.6.173.220,75.75.75.75,DNS,73,Standard query 0xf57e  AAAA ww3.hdnux.com
172,0.31296,24.6.173.220,75.75.75.75,DNS,73,Standard query 0x01b9  AAAA ww2.hdnux.com
173,0.313039,24.6.173.220,75.75.75.75,DNS,73,Standard query 0xba50  AAAA ww1.hdnux.com
174,0.31368,208.93.137.180,24.6.173.220,TCP,60,80 > 10615 [ACK] Seq=15438 Ack=786 Win=8064 Len=0
175,0.314498,208.93.137.180,24.6.173.220,TCP,1514,[TCP segment of a reassembled PDU]
176,0.315721,208.93.137.180,24.6.173.220,HTTP,940,HTTP/1.1 200 OK  (application/x-javascript)
177,0.315726,75.75.75.75,24.6.173.220,DNS,218,Standard query response 0xfe93  CNAME prod-tracking-http-89765270.us-east-1.elb.amazonaws.com A 107.22.233.219 A 23.21.54.17 A 23.21.50.193 A 23.21.231.73
178,0.315728,75.75.75.75,24.6.173.220,DNS,133,Standard query response 0x6505  CNAME orig-10056.hearst.cotcdn.net A 208.93.137.190
179,0.31573,75.75.75.75,24.6.173.220,DNS,208,Standard query response 0xcf9a  CNAME www1nc-1174862120.us-east-1.elb.amazonaws.com A 184.73.197.77 A 54.243.165.93 A 184.73.204.71 A 50.17.227.189
180,0.316149,24.6.173.220,208.93.137.180,TCP,54,10615 > 80 [ACK] Seq=786 Ack=17784 Win=65700 Len=0
181,0.316488,24.6.173.220,208.93.137.180,HTTP,393,GET /img/modules/siteheader/wea001/arrow.gif HTTP/1.1 
182,0.316803,24.6.173.220,75.75.75.75,DNS,88,Standard query 0xbdc4  AAAA analytics.apnewsregistry.com
183,0.316804,24.6.173.220,75.75.75.75,DNS,75,Standard query 0x00b7  AAAA imgs.sfgate.com
184,0.317004,24.6.173.220,75.75.75.75,DNS,88,Standard query 0x2b9a  AAAA us2widget.nimblecommerce.com
185,0.31864,208.93.137.180,24.6.173.220,HTTP,630,HTTP/1.1 200 OK  (application/x-javascript)
186,0.319041,24.6.173.220,208.93.137.180,TCP,54,10619 > 80 [ACK] Seq=618 Ack=7558 Win=65700 Len=0
187,0.319475,24.6.173.220,208.93.137.180,HTTP,389,GET /img/modules/siteheader/closeBtn.gif HTTP/1.1 
188,0.319793,208.93.137.180,24.6.173.220,TCP,1514,[TCP segment of a reassembled PDU]
189,0.319797,208.93.137.180,24.6.173.220,HTTP,903,HTTP/1.1 200 OK  (application/x-javascript)
190,0.320661,24.6.173.220,208.93.137.180,TCP,54,10617 > 80 [ACK] Seq=940 Ack=21119 Win=65700 Len=0
191,0.32096,24.6.173.220,208.93.137.180,HTTP,403,GET /img/partners/target/target_weekly_ad_animated.gif HTTP/1.1 
192,0.328494,208.93.137.180,24.6.173.220,TCP,1514,[TCP segment of a reassembled PDU]
193,0.329492,208.93.137.180,24.6.173.220,TCP,1514,[TCP segment of a reassembled PDU]
194,0.329495,208.93.137.180,24.6.173.220,HTTP,975,HTTP/1.1 200 OK  (GIF89a) (GIF89a) (image/gif)
195,0.3295,208.93.137.180,24.6.173.220,TCP,60,80 > 10625 [ACK] Seq=1 Ack=291 Win=6912 Len=0
196,0.329515,208.93.137.180,24.6.173.220,TCP,1514,[TCP segment of a reassembled PDU]
197,0.33002,24.6.173.220,208.93.137.180,HTTP,376,GET /img/utils/rss_icon.png HTTP/1.1 
198,0.330714,208.93.137.180,24.6.173.220,HTTP,686,HTTP/1.1 200 OK  (PNG)
199,0.330716,208.93.137.180,24.6.173.220,HTTP,823,HTTP/1.1 200 OK  (application/x-javascript)
200,0.331061,24.6.173.220,208.93.137.180,TCP,54,10620 > 80 [ACK] Seq=937 Ack=21712 Win=256960 Len=0
201,0.331354,24.6.173.220,208.93.137.180,HTTP,402,GET /img/modules/slideshow/promo/wide/button-prev.gif HTTP/1.1 
202,0.335478,208.93.137.180,24.6.173.220,TCP,1514,[TCP segment of a reassembled PDU]
203,0.335718,24.6.173.220,208.93.137.180,TCP,54,10616 > 80 [ACK] Seq=330 Ack=18981 Win=65700 Len=0
204,0.336476,208.93.137.180,24.6.173.220,TCP,1514,[TCP segment of a reassembled PDU]
205,0.336478,208.93.137.180,24.6.173.220,TCP,1514,[TCP segment of a reassembled PDU]
206,0.336935,24.6.173.220,208.93.137.180,TCP,54,10616 > 80 [ACK] Seq=330 Ack=21901 Win=65700 Len=0
207,0.337687,208.93.137.180,24.6.173.220,TCP,1514,[TCP segment of a reassembled PDU]
208,0.337689,208.93.137.180,24.6.173.220,TCP,1514,[TCP segment of a reassembled PDU]
209,0.337692,75.75.75.75,24.6.173.220,DNS,209,Standard query response 0xbdc4  CNAME prod-tracking-http-89765270.us-east-1.elb.amazonaws.com
210,0.337697,75.75.75.75,24.6.173.220,DNS,174,Standard query response 0xba50  CNAME orig-10055.hearst.cotcdn.net
211,0.337698,75.75.75.75,24.6.173.220,DNS,174,Standard query response 0x01b9  CNAME orig-10055.hearst.cotcdn.net
212,0.33826,24.6.173.220,208.93.137.180,TCP,54,10616 > 80 [ACK] Seq=330 Ack=24821 Win=65700 Len=0
213,0.339137,75.75.75.75,24.6.173.220,DNS,174,Standard query response 0xf57e  CNAME orig-10055.hearst.cotcdn.net
214,0.339153,24.6.173.220,208.93.137.180,TCP,66,10627 > 80 [SYN] Seq=0 Win=8192 Len=0 MSS=1460 WS=4 SACK_PERM=1
215,0.339446,24.6.173.220,208.93.137.180,TCP,66,10628 > 80 [SYN] Seq=0 Win=8192 Len=0 MSS=1460 WS=4 SACK_PERM=1
216,0.339678,24.6.173.220,208.93.137.180,TCP,66,10629 > 80 [SYN] Seq=0 Win=8192 Len=0 MSS=1460 WS=4 SACK_PERM=1
217,0.339991,24.6.173.220,208.93.137.180,TCP,66,10630 > 80 [SYN] Seq=0 Win=8192 Len=0 MSS=1460 WS=4 SACK_PERM=1
218,0.340172,24.6.173.220,208.93.137.180,TCP,66,10631 > 80 [SYN] Seq=0 Win=8192 Len=0 MSS=1460 WS=4 SACK_PERM=1
219,0.340414,24.6.173.220,208.93.137.180,TCP,66,10632 > 80 [SYN] Seq=0 Win=8192 Len=0 MSS=1460 WS=4 SACK_PERM=1
220,0.340697,24.6.173.220,208.93.137.180,TCP,66,10633 > 80 [SYN] Seq=0 Win=8192 Len=0 MSS=1460 WS=4 SACK_PERM=1
221,0.340709,208.93.137.180,24.6.173.220,HTTP,455,HTTP/1.1 200 OK  (GIF89a) (GIF89a) (image/gif)
222,0.340901,24.6.173.220,208.93.137.180,TCP,66,10634 > 80 [SYN] Seq=0 Win=8192 Len=0 MSS=1460 WS=4 SACK_PERM=1
223,0.341221,24.6.173.220,107.22.233.219,TCP,66,10635 > 80 [SYN] Seq=0 Win=8192 Len=0 MSS=1460 WS=4 SACK_PERM=1
224,0.341409,24.6.173.220,208.93.137.180,TCP,66,10636 > 80 [SYN] Seq=0 Win=8192 Len=0 MSS=1460 WS=4 SACK_PERM=1
225,0.34165,24.6.173.220,107.22.233.219,TCP,66,10637 > 80 [SYN] Seq=0 Win=8192 Len=0 MSS=1460 WS=4 SACK_PERM=1
226,0.341673,208.93.137.180,24.6.173.220,HTTP,585,HTTP/1.1 200 OK  (GIF89a) (GIF89a) (image/gif)
227,0.341854,24.6.173.220,208.93.137.180,TCP,66,10638 > 80 [SYN] Seq=0 Win=8192 Len=0 MSS=1460 WS=4 SACK_PERM=1
228,0.342222,24.6.173.220,208.93.137.180,TCP,66,10639 > 80 [SYN] Seq=0 Win=8192 Len=0 MSS=1460 WS=4 SACK_PERM=1
229,0.342471,24.6.173.220,208.93.137.180,TCP,66,10640 > 80 [SYN] Seq=0 Win=8192 Len=0 MSS=1460 WS=4 SACK_PERM=1
230,0.342589,208.93.137.180,24.6.173.220,TCP,1514,[TCP segment of a reassembled PDU]
231,0.342592,208.93.137.180,24.6.173.220,TCP,1514,[TCP segment of a reassembled PDU]
232,0.342598,208.93.137.180,24.6.173.220,TCP,1514,[TCP segment of a reassembled PDU]
233,0.3426,208.93.137.180,24.6.173.220,TCP,1514,[TCP segment of a reassembled PDU]
234,0.342823,24.6.173.220,208.93.137.180,HTTP,402,GET /img/modules/slideshow/promo/wide/button-next.gif HTTP/1.1 
235,0.342824,24.6.173.220,208.93.137.180,TCP,54,10617 > 80 [ACK] Seq=1289 Ack=26959 Win=65700 Len=0
236,0.343603,208.93.137.180,24.6.173.220,TCP,1514,[TCP segment of a reassembled PDU]
237,0.344419,208.93.137.180,24.6.173.220,TCP,1514,[TCP segment of a reassembled PDU]
238,0.344426,208.93.137.180,24.6.173.220,TCP,1514,[TCP segment of a reassembled PDU]
239,0.344429,208.93.137.180,24.6.173.220,TCP,1514,[TCP segment of a reassembled PDU]
240,0.344628,24.6.173.220,208.93.137.180,TCP,54,10617 > 80 [ACK] Seq=1289 Ack=32799 Win=65700 Len=0
241,0.345438,208.93.137.180,24.6.173.220,TCP,1514,[TCP segment of a reassembled PDU]
242,0.34544,208.93.137.180,24.6.173.220,TCP,1514,[TCP segment of a reassembled PDU]
243,0.345509,24.6.173.220,208.93.137.180,TCP,54,10617 > 80 [ACK] Seq=1289 Ack=35719 Win=65700 Len=0
244,0.346331,208.93.137.180,24.6.173.220,TCP,1514,[TCP segment of a reassembled PDU]
245,0.346333,208.93.137.180,24.6.173.220,TCP,1514,[TCP segment of a reassembled PDU]
246,0.346396,24.6.173.220,208.93.137.180,TCP,54,10617 > 80 [ACK] Seq=1289 Ack=38639 Win=65700 Len=0
247,0.347153,208.93.137.180,24.6.173.220,TCP,1514,[TCP segment of a reassembled PDU]
248,0.347157,208.93.137.180,24.6.173.220,TCP,1514,[TCP segment of a reassembled PDU]
249,0.347226,24.6.173.220,208.93.137.180,TCP,54,10617 > 80 [ACK] Seq=1289 Ack=41559 Win=65700 Len=0
250,0.348043,208.93.137.180,24.6.173.220,TCP,1514,[TCP segment of a reassembled PDU]
251,0.348046,208.93.137.180,24.6.173.220,TCP,1514,[TCP segment of a reassembled PDU]
252,0.34811,24.6.173.220,208.93.137.180,TCP,54,10617 > 80 [ACK] Seq=1289 Ack=44479 Win=65700 Len=0
253,0.348229,24.6.173.220,75.75.75.75,DNS,75,Standard query 0x00b7  AAAA imgs.sfgate.com
254,0.348883,208.93.137.180,24.6.173.220,TCP,1514,[TCP segment of a reassembled PDU]
255,0.348885,208.93.137.180,24.6.173.220,TCP,1514,[TCP segment of a reassembled PDU]
256,0.348953,24.6.173.220,208.93.137.180,TCP,54,10617 > 80 [ACK] Seq=1289 Ack=47399 Win=65700 Len=0
257,0.349127,24.6.173.220,75.75.75.75,DNS,88,Standard query 0x2b9a  AAAA us2widget.nimblecommerce.com
258,0.349709,208.93.137.180,24.6.173.220,TCP,1514,[TCP segment of a reassembled PDU]
259,0.350511,208.93.137.180,24.6.173.220,TCP,1514,[TCP segment of a reassembled PDU]
260,0.350514,208.93.137.180,24.6.173.220,TCP,1514,[TCP segment of a reassembled PDU]
261,0.350516,208.93.137.180,24.6.173.220,TCP,1514,[TCP segment of a reassembled PDU]
262,0.350575,24.6.173.220,208.93.137.180,TCP,54,10617 > 80 [ACK] Seq=1289 Ack=53239 Win=65700 Len=0
263,0.351322,208.93.137.180,24.6.173.220,HTTP,576,HTTP/1.1 200 OK  (GIF89a) (GIF89a) (image/gif)
264,0.351323,75.75.75.75,24.6.173.220,DNS,176,Standard query response 0x00b7  CNAME orig-10056.hearst.cotcdn.net
265,0.351325,75.75.75.75,24.6.173.220,DNS,199,Standard query response 0x2b9a  CNAME www1nc-1174862120.us-east-1.elb.amazonaws.com
266,0.351326,208.93.137.180,24.6.173.220,HTTP,1108,HTTP/1.1 200 OK  (PNG)
267,0.352223,24.6.173.220,184.73.197.77,TCP,66,10641 > 80 [SYN] Seq=0 Win=8192 Len=0 MSS=1460 WS=4 SACK_PERM=1
268,0.352462,208.93.137.180,24.6.173.220,HTTP,817,HTTP/1.1 200 OK  (GIF89a) (GIF89a) (image/gif)
269,0.352643,24.6.173.220,184.73.197.77,TCP,66,10642 > 80 [SYN] Seq=0 Win=8192 Len=0 MSS=1460 WS=4 SACK_PERM=1
270,0.353018,24.6.173.220,208.93.137.190,TCP,66,10643 > 80 [SYN] Seq=0 Win=8192 Len=0 MSS=1460 WS=4 SACK_PERM=1
271,0.353213,24.6.173.220,208.93.137.190,TCP,66,10644 > 80 [SYN] Seq=0 Win=8192 Len=0 MSS=1460 WS=4 SACK_PERM=1
272,0.356863,208.93.137.180,24.6.173.220,TCP,1514,[TCP segment of a reassembled PDU]
273,0.357865,208.93.137.180,24.6.173.220,TCP,1514,[TCP segment of a reassembled PDU]
274,0.357869,208.93.137.180,24.6.173.220,HTTP,130,HTTP/1.1 200 OK  (text/css)
275,0.358083,24.6.173.220,208.93.137.180,TCP,54,10616 > 80 [ACK] Seq=330 Ack=27817 Win=65700 Len=0
276,0.361736,208.93.137.180,24.6.173.220,TCP,66,"80 > 10627 [SYN, ACK] Seq=0 Ack=1 Win=5840 Len=0 MSS=1460 SACK_PERM=1 WS=128"
277,0.361858,24.6.173.220,208.93.137.180,TCP,54,10627 > 80 [ACK] Seq=1 Ack=1 Win=65700 Len=0
278,0.362246,24.6.173.220,208.93.137.180,HTTP,401,GET /photos/16/01/46/3676557/5/square_horiz_promo.jpg HTTP/1.1 
279,0.362625,208.93.137.180,24.6.173.220,TCP,66,"80 > 10628 [SYN, ACK] Seq=0 Ack=1 Win=5840 Len=0 MSS=1460 SACK_PERM=1 WS=128"
280,0.362626,208.93.137.180,24.6.173.220,TCP,66,"80 > 10629 [SYN, ACK] Seq=0 Ack=1 Win=5840 Len=0 MSS=1460 SACK_PERM=1 WS=128"
281,0.362627,208.93.137.180,24.6.173.220,TCP,66,"80 > 10630 [SYN, ACK] Seq=0 Ack=1 Win=5840 Len=0 MSS=1460 SACK_PERM=1 WS=128"
282,0.362629,208.93.137.180,24.6.173.220,TCP,66,"80 > 10640 [SYN, ACK] Seq=0 Ack=1 Win=5840 Len=0 MSS=1460 SACK_PERM=1 WS=128"
283,0.36263,208.93.137.180,24.6.173.220,TCP,66,"80 > 10639 [SYN, ACK] Seq=0 Ack=1 Win=5840 Len=0 MSS=1460 SACK_PERM=1 WS=128"
284,0.362632,208.93.137.180,24.6.173.220,TCP,66,"80 > 10631 [SYN, ACK] Seq=0 Ack=1 Win=5840 Len=0 MSS=1460 SACK_PERM=1 WS=128"
285,0.362633,208.93.137.180,24.6.173.220,TCP,66,"80 > 10633 [SYN, ACK] Seq=0 Ack=1 Win=5840 Len=0 MSS=1460 SACK_PERM=1 WS=128"
286,0.362635,208.93.137.180,24.6.173.220,TCP,66,"80 > 10632 [SYN, ACK] Seq=0 Ack=1 Win=5840 Len=0 MSS=1460 SACK_PERM=1 WS=128"
287,0.362636,208.93.137.180,24.6.173.220,TCP,66,"80 > 10636 [SYN, ACK] Seq=0 Ack=1 Win=5840 Len=0 MSS=1460 SACK_PERM=1 WS=128"
288,0.362638,208.93.137.180,24.6.173.220,TCP,66,"80 > 10634 [SYN, ACK] Seq=0 Ack=1 Win=5840 Len=0 MSS=1460 SACK_PERM=1 WS=128"
289,0.362641,208.93.137.180,24.6.173.220,TCP,66,"80 > 10638 [SYN, ACK] Seq=0 Ack=1 Win=5840 Len=0 MSS=1460 SACK_PERM=1 WS=128"
290,0.36299,24.6.173.220,208.93.137.180,HTTP,395,GET /photos/16/02/37/3680253/3/blockstates2.jpg HTTP/1.1 
291,0.362994,24.6.173.220,208.93.137.180,TCP,54,10629 > 80 [ACK] Seq=1 Ack=1 Win=65700 Len=0
292,0.36302,24.6.173.220,208.93.137.180,TCP,54,10630 > 80 [ACK] Seq=1 Ack=1 Win=65700 Len=0
293,0.36304,24.6.173.220,208.93.137.180,TCP,54,10640 > 80 [ACK] Seq=1 Ack=1 Win=65700 Len=0
294,0.363062,24.6.173.220,208.93.137.180,TCP,54,10639 > 80 [ACK] Seq=1 Ack=1 Win=65700 Len=0
295,0.363081,24.6.173.220,208.93.137.180,TCP,54,10631 > 80 [ACK] Seq=1 Ack=1 Win=65700 Len=0
296,0.363101,24.6.173.220,208.93.137.180,TCP,54,10633 > 80 [ACK] Seq=1 Ack=1 Win=65700 Len=0
297,0.363123,24.6.173.220,208.93.137.180,TCP,54,10632 > 80 [ACK] Seq=1 Ack=1 Win=65700 Len=0
298,0.363142,24.6.173.220,208.93.137.180,TCP,54,10636 > 80 [ACK] Seq=1 Ack=1 Win=65700 Len=0
299,0.363163,24.6.173.220,208.93.137.180,TCP,54,10634 > 80 [ACK] Seq=1 Ack=1 Win=65700 Len=0
300,0.363184,24.6.173.220,208.93.137.180,TCP,54,10638 > 80 [ACK] Seq=1 Ack=1 Win=65700 Len=0
301,0.363304,24.6.173.220,208.93.137.180,HTTP,395,GET /photos/16/01/41/3676237/5/blockstates2.jpg HTTP/1.1 
302,0.363866,24.6.173.220,208.93.137.180,HTTP,401,GET /photos/16/02/34/3680004/3/square_horiz_promo.jpg HTTP/1.1 
303,0.364151,24.6.173.220,208.93.137.180,HTTP,395,GET /photos/16/01/31/3675736/3/blockstates2.jpg HTTP/1.1 
304,0.364679,24.6.173.220,208.93.137.180,HTTP,401,GET /photos/16/02/35/3680074/3/square_horiz_promo.jpg HTTP/1.1 
305,0.368828,75.75.75.75,24.6.173.220,DNS,199,Standard query response 0x2b9a  CNAME www1nc-1174862120.us-east-1.elb.amazonaws.com
306,0.373042,208.93.137.190,24.6.173.220,TCP,66,"80 > 10644 [SYN, ACK] Seq=0 Ack=1 Win=5840 Len=0 MSS=1460 SACK_PERM=1 WS=128"
307,0.37319,24.6.173.220,208.93.137.190,TCP,54,10644 > 80 [ACK] Seq=1 Ack=1 Win=65700 Len=0
308,0.373581,24.6.173.220,208.93.137.190,HTTP,385,GET /graphics/utils/hearst_logo.gif HTTP/1.1 
309,0.373983,208.93.137.190,24.6.173.220,TCP,66,"80 > 10643 [SYN, ACK] Seq=0 Ack=1 Win=5840 Len=0 MSS=1460 SACK_PERM=1 WS=128"
310,0.373986,208.93.137.180,24.6.173.220,HTTP,817,HTTP/1.1 200 OK  (GIF89a) (GIF89a) (image/gif)
311,0.374313,24.6.173.220,208.93.137.190,TCP,54,10643 > 80 [ACK] Seq=1 Ack=1 Win=65700 Len=0
312,0.375812,75.75.75.75,24.6.173.220,DNS,176,Standard query response 0x00b7  CNAME orig-10056.hearst.cotcdn.net
313,0.379716,66.109.241.50,24.6.173.220,TCP,66,"80 > 10622 [SYN, ACK] Seq=0 Ack=1 Win=16384 Len=0 MSS=1380 WS=1 SACK_PERM=1"
314,0.379847,24.6.173.220,66.109.241.50,TCP,54,10622 > 80 [ACK] Seq=1 Ack=1 Win=66240 Len=0
315,0.380407,24.6.173.220,66.109.241.50,HTTP,373,GET /css/modal.css HTTP/1.1 
316,0.380634,66.109.241.50,24.6.173.220,TCP,66,"80 > 10623 [SYN, ACK] Seq=0 Ack=1 Win=16384 Len=0 MSS=1380 WS=1 SACK_PERM=1"
317,0.380635,66.109.241.50,24.6.173.220,TCP,66,"80 > 10624 [SYN, ACK] Seq=0 Ack=1 Win=16384 Len=0 MSS=1380 WS=1 SACK_PERM=1"
318,0.380637,66.109.241.50,24.6.173.220,TCP,66,"80 > 10621 [SYN, ACK] Seq=0 Ack=1 Win=16384 Len=0 MSS=1380 WS=1 SACK_PERM=1"
319,0.380778,24.6.173.220,66.109.241.50,TCP,54,10623 > 80 [ACK] Seq=1 Ack=1 Win=66240 Len=0
320,0.380803,24.6.173.220,66.109.241.50,TCP,54,10624 > 80 [ACK] Seq=1 Ack=1 Win=66240 Len=0
321,0.380823,24.6.173.220,66.109.241.50,TCP,54,10621 > 80 [ACK] Seq=1 Ack=1 Win=66240 Len=0
322,0.381144,24.6.173.220,66.109.241.50,HTTP,369,GET /js/jquery.digitaldoor.js HTTP/1.1 
323,0.385569,208.93.137.180,24.6.173.220,TCP,60,80 > 10627 [ACK] Seq=1 Ack=348 Win=6912 Len=0
324,0.386659,208.93.137.180,24.6.173.220,TCP,1514,[TCP segment of a reassembled PDU]
325,0.38771,208.93.137.180,24.6.173.220,HTTP,668,HTTP/1.1 200 OK  (JPEG JFIF image)
326,0.387718,208.93.137.180,24.6.173.220,TCP,60,80 > 10628 [ACK] Seq=1 Ack=342 Win=6912 Len=0
327,0.387719,208.93.137.180,24.6.173.220,TCP,60,80 > 10629 [ACK] Seq=1 Ack=342 Win=6912 Len=0
328,0.387723,208.93.137.180,24.6.173.220,TCP,60,80 > 10634 [ACK] Seq=1 Ack=348 Win=6912 Len=0
329,0.387725,208.93.137.180,24.6.173.220,TCP,60,80 > 10638 [ACK] Seq=1 Ack=342 Win=6912 Len=0
330,0.387726,208.93.137.180,24.6.173.220,TCP,1514,[TCP segment of a reassembled PDU]
331,0.387729,208.93.137.180,24.6.173.220,TCP,1514,[TCP segment of a reassembled PDU]
332,0.388053,24.6.173.220,208.93.137.180,TCP,54,10627 > 80 [ACK] Seq=348 Ack=2075 Win=65700 Len=0
333,0.38808,24.6.173.220,208.93.137.180,TCP,54,10628 > 80 [ACK] Seq=342 Ack=2921 Win=65700 Len=0
334,0.388832,208.93.137.180,24.6.173.220,TCP,1514,[TCP segment of a reassembled PDU]
335,0.388834,208.93.137.180,24.6.173.220,TCP,1514,[TCP segment of a reassembled PDU]
336,0.388938,24.6.173.220,208.93.137.180,TCP,54,10628 > 80 [ACK] Seq=342 Ack=5841 Win=65700 Len=0
337,0.389742,208.93.137.180,24.6.173.220,TCP,1514,[TCP segment of a reassembled PDU]
338,0.389744,208.93.137.180,24.6.173.220,TCP,1514,[TCP segment of a reassembled PDU]
339,0.38986,24.6.173.220,208.93.137.180,TCP,54,10628 > 80 [ACK] Seq=342 Ack=8761 Win=65700 Len=0
340,0.39062,208.93.137.180,24.6.173.220,TCP,1514,[TCP segment of a reassembled PDU]
341,0.390623,208.93.137.180,24.6.173.220,TCP,60,80 > 10639 [ACK] Seq=1 Ack=348 Win=6912 Len=0
342,0.390624,208.93.137.180,24.6.173.220,TCP,1514,[TCP segment of a reassembled PDU]
343,0.390737,24.6.173.220,208.93.137.180,TCP,54,10628 > 80 [ACK] Seq=342 Ack=11681 Win=65700 Len=0
344,0.391488,208.93.137.180,24.6.173.220,TCP,1514,[TCP segment of a reassembled PDU]
345,0.39149,208.93.137.180,24.6.173.220,TCP,1514,[TCP segment of a reassembled PDU]
346,0.391655,24.6.173.220,208.93.137.180,TCP,54,10628 > 80 [ACK] Seq=342 Ack=14601 Win=65700 Len=0
347,0.392412,208.93.137.180,24.6.173.220,TCP,1514,[TCP segment of a reassembled PDU]
348,0.392415,208.93.137.180,24.6.173.220,TCP,1514,[TCP segment of a reassembled PDU]
349,0.3926,24.6.173.220,208.93.137.180,TCP,54,10628 > 80 [ACK] Seq=342 Ack=17521 Win=65700 Len=0
350,0.393355,208.93.137.180,24.6.173.220,TCP,1514,[TCP segment of a reassembled PDU]
351,0.393357,208.93.137.180,24.6.173.220,TCP,1514,[TCP segment of a reassembled PDU]
352,0.393362,208.93.137.180,24.6.173.220,HTTP,479,HTTP/1.1 200 OK  (JPEG JFIF image)
353,0.393694,24.6.173.220,208.93.137.180,TCP,54,10628 > 80 [ACK] Seq=342 Ack=19406 Win=65700 Len=0
354,0.394507,208.93.137.180,24.6.173.220,TCP,1514,[TCP segment of a reassembled PDU]
355,0.39451,208.93.137.180,24.6.173.220,TCP,1514,[TCP segment of a reassembled PDU]
356,0.394708,24.6.173.220,208.93.137.180,TCP,54,10638 > 80 [ACK] Seq=342 Ack=2921 Win=65700 Len=0
357,0.395463,208.93.137.180,24.6.173.220,TCP,1514,[TCP segment of a reassembled PDU]
358,0.395465,208.93.137.180,24.6.173.220,TCP,1514,[TCP segment of a reassembled PDU]
359,0.395553,24.6.173.220,208.93.137.180,TCP,54,10629 > 80 [ACK] Seq=342 Ack=2921 Win=65700 Len=0
360,0.396338,208.93.137.180,24.6.173.220,TCP,1514,[TCP segment of a reassembled PDU]
361,0.39634,208.93.137.180,24.6.173.220,TCP,1514,[TCP segment of a reassembled PDU]
362,0.396419,24.6.173.220,208.93.137.180,TCP,54,10638 > 80 [ACK] Seq=342 Ack=5841 Win=65700 Len=0
363,0.397173,208.93.137.180,24.6.173.220,TCP,1514,[TCP segment of a reassembled PDU]
364,0.397175,208.93.137.180,24.6.173.220,TCP,1514,[TCP segment of a reassembled PDU]
365,0.397255,24.6.173.220,208.93.137.180,TCP,54,10629 > 80 [ACK] Seq=342 Ack=5841 Win=65700 Len=0
366,0.398033,208.93.137.180,24.6.173.220,TCP,1514,[TCP segment of a reassembled PDU]
367,0.398092,24.6.173.220,208.93.137.180,TCP,54,10638 > 80 [ACK] Seq=342 Ack=8761 Win=65700 Len=0
368,0.398866,208.93.137.180,24.6.173.220,TCP,1514,[TCP segment of a reassembled PDU]
369,0.398874,208.93.137.180,24.6.173.220,TCP,1514,[TCP segment of a reassembled PDU]
370,0.39888,208.93.137.180,24.6.173.220,TCP,1514,[TCP segment of a reassembled PDU]
371,0.398998,24.6.173.220,208.93.137.180,TCP,54,10629 > 80 [ACK] Seq=342 Ack=8761 Win=65700 Len=0
372,0.399815,208.93.137.180,24.6.173.220,TCP,1514,[TCP segment of a reassembled PDU]
373,0.399816,208.93.137.180,24.6.173.220,TCP,1514,[TCP segment of a reassembled PDU]
374,0.400083,24.6.173.220,208.93.137.180,TCP,54,10638 > 80 [ACK] Seq=342 Ack=11681 Win=65700 Len=0
375,0.400859,208.93.137.180,24.6.173.220,HTTP,819,HTTP/1.1 200 OK  (JPEG JFIF image)
376,0.400861,208.93.137.180,24.6.173.220,TCP,1514,[TCP segment of a reassembled PDU]
377,0.400991,24.6.173.220,208.93.137.180,TCP,54,10639 > 80 [ACK] Seq=348 Ack=2226 Win=65700 Len=0
378,0.401765,208.93.137.180,24.6.173.220,TCP,1514,[TCP segment of a reassembled PDU]
379,0.401768,208.93.137.180,24.6.173.220,HTTP,1320,HTTP/1.1 200 OK  (JPEG JFIF image)
380,0.401773,208.93.137.180,24.6.173.220,HTTP,1455,HTTP/1.1 200 OK  (JPEG JFIF image)
381,0.401885,24.6.173.220,208.93.137.180,TCP,54,10629 > 80 [ACK] Seq=342 Ack=11487 Win=65700 Len=0
382,0.401909,24.6.173.220,208.93.137.180,TCP,54,10638 > 80 [ACK] Seq=342 Ack=14542 Win=65700 Len=0
383,0.402704,208.93.137.180,24.6.173.220,TCP,1514,[TCP segment of a reassembled PDU]
384,0.402707,208.93.137.180,24.6.173.220,HTTP,722,HTTP/1.1 200 OK  (JPEG JFIF image)
385,0.402708,208.93.137.190,24.6.173.220,TCP,60,80 > 10644 [ACK] Seq=1 Ack=332 Win=6912 Len=0
386,0.402873,24.6.173.220,208.93.137.180,TCP,54,10634 > 80 [ACK] Seq=348 Ack=2129 Win=65700 Len=0
387,0.403622,208.93.137.190,24.6.173.220,HTTP,1139,HTTP/1.1 200 OK  (GIF89a) (GIF89a) (image/gif)
388,0.436294,24.6.173.220,208.93.137.180,HTTP,348,GET /Scripts/loadAdsMain.js HTTP/1.1 
389,0.43861,107.22.233.219,24.6.173.220,TCP,66,"80 > 10635 [SYN, ACK] Seq=0 Ack=1 Win=5840 Len=0 MSS=1460 SACK_PERM=1 WS=256"
390,0.438735,24.6.173.220,107.22.233.219,TCP,54,10635 > 80 [ACK] Seq=1 Ack=1 Win=65700 Len=0
391,0.439254,24.6.173.220,107.22.233.219,HTTP,433,GET /analytics/v2/image.svc/AP/RWS/sfgate.com/MAI/4001083/E/prod/AT/HL HTTP/1.1 
392,0.439503,107.22.233.219,24.6.173.220,TCP,66,"80 > 10637 [SYN, ACK] Seq=0 Ack=1 Win=5840 Len=0 MSS=1460 SACK_PERM=1 WS=256"
393,0.439634,24.6.173.220,107.22.233.219,TCP,54,10637 > 80 [ACK] Seq=1 Ack=1 Win=65700 Len=0
394,0.439634,24.6.173.220,208.93.137.180,HTTP,353,GET /favicon.ico HTTP/1.1 
395,0.449746,184.73.197.77,24.6.173.220,TCP,66,"80 > 10642 [SYN, ACK] Seq=0 Ack=1 Win=5840 Len=0 MSS=1460 SACK_PERM=1 WS=256"
396,0.449895,24.6.173.220,184.73.197.77,TCP,54,10642 > 80 [ACK] Seq=1 Ack=1 Win=65700 Len=0
397,0.450366,24.6.173.220,184.73.197.77,HTTP,361,GET /widget.action?wId=10281 HTTP/1.1 
398,0.450684,184.73.197.77,24.6.173.220,TCP,66,"80 > 10641 [SYN, ACK] Seq=0 Ack=1 Win=5840 Len=0 MSS=1460 SACK_PERM=1 WS=256"
399,0.450875,24.6.173.220,184.73.197.77,TCP,54,10641 > 80 [ACK] Seq=1 Ack=1 Win=65700 Len=0
400,0.455823,208.93.137.180,24.6.173.220,TCP,1514,[TCP segment of a reassembled PDU]
401,0.456932,208.93.137.180,24.6.173.220,TCP,1514,[TCP segment of a reassembled PDU]
402,0.456937,208.93.137.180,24.6.173.220,HTTP,631,HTTP/1.1 200 OK  (application/x-javascript)
403,0.457226,24.6.173.220,208.93.137.180,TCP,54,10625 > 80 [ACK] Seq=585 Ack=4267 Win=65700 Len=0
404,0.461851,208.93.137.180,24.6.173.220,HTTP,1286,HTTP/1.1 200 OK  (image/x-icon)
405,0.464208,24.6.173.220,75.75.75.75,DNS,78,Standard query 0xe6f5  A e.yieldmanager.net
406,0.465477,24.6.173.220,208.93.137.180,HTTP,363,GET /SRO/GetJS?url=www.sfgate.com/feedback HTTP/1.1 
407,0.47679,75.75.75.75,24.6.173.220,DNS,242,Standard query response 0xe6f5  CNAME geoycs-l.gy1.b.yahoodns.net CNAME fo-anyycs-l.ay1.b.yahoodns.net A 98.137.88.34 A 98.137.88.35 A 98.137.88.83 A 98.137.88.84 A 98.137.88.36 A 98.137.88.37
408,0.477624,24.6.173.220,75.75.75.75,DNS,78,Standard query 0x4fe5  AAAA e.yieldmanager.net
409,0.481081,66.109.241.50,24.6.173.220,HTTP,503,HTTP/1.1 200 OK  (text/css)
410,0.48804,66.109.241.50,24.6.173.220,TCP,1434,[TCP segment of a reassembled PDU]
411,0.489251,66.109.241.50,24.6.173.220,TCP,1434,[TCP segment of a reassembled PDU]
412,0.489443,24.6.173.220,66.109.241.50,TCP,54,10623 > 80 [ACK] Seq=316 Ack=2761 Win=66240 Len=0
